number,values_0,values_1,datetime_start,datetime_complete,duration,params_beta_max,params_beta_min,params_beta_schedule_type,params_gamma,user_attrs_best_cost,user_attrs_time_s,state,solver
639,0.0,10.0,2026-07-23 15:47:08.922313,2026-07-23 15:47:09.022275,0 days 00:00:00.099962,1.0,10000.0,geometric,1.0,,0.0,COMPLETE,PA
640,0.0,10.0,2026-07-23 15:47:09.023978,2026-07-23 15:47:09.057772,0 days 00:00:00.033794,100.0,1000.0,linear,1000.0,,0.0,COMPLETE,PA
641,0.0,10.0,2026-07-23 15:47:09.031006,2026-07-23 15:47:16.764601,0 days 00:00:07.733595,0.1,0.1,geometric,1000.0,,7.703,COMPLETE,PA
642,0.0,10.0,2026-07-23 15:47:09.068455,2026-07-23 15:47:09.113671,0 days 00:00:00.045216,100.0,1000.0,linear,10.0,,0.0,COMPLETE,PA
643,0.0,10.0,2026-07-23 15:47:09.072832,2026-07-23 15:47:17.174769,0 days 00:00:08.101937,10.0,10.0,linear,1.0,,8.065,COMPLETE,PA
644,0.0,10.0,2026-07-23 15:47:09.121892,2026-07-23 15:47:16.952161,0 days 00:00:07.830269,10.0,0.001,geometric,1000.0,,7.802,COMPLETE,PA
645,0.0,10.0,2026-07-23 15:47:09.208724,2026-07-23 15:47:16.921499,0 days 00:00:07.712775,100.0,10.0,linear,0.01,,7.682,COMPLETE,PA
646,0.2,1.7153846153846153,2026-07-23 15:47:14.966340,2026-07-23 15:47:22.717911,0 days 00:00:07.751571,1000.0,0.1,geometric,0.01,223.0,7.732,COMPLETE,PA
647,0.0,10.0,2026-07-23 15:47:15.388010,2026-07-23 15:47:15.405952,0 days 00:00:00.017942,0.0001,100.0,geometric,1000.0,,0.0,COMPLETE,PA
648,0.0,10.0,2026-07-23 15:47:15.406133,2026-07-23 15:47:23.197949,0 days 00:00:07.791816,100.0,0.001,linear,10.0,,7.769,COMPLETE,PA
649,0.0,10.0,2026-07-23 15:47:16.096017,2026-07-23 15:47:24.053677,0 days 00:00:07.957660,100.0,0.01,linear,10000.0,,7.941,COMPLETE,PA
650,0.0,10.0,2026-07-23 15:47:16.391427,2026-07-23 15:47:16.430089,0 days 00:00:00.038662,0.01,1000.0,linear,1.0,,0.0,COMPLETE,PA
651,0.0,10.0,2026-07-23 15:47:16.431941,2026-07-23 15:47:23.828391,0 days 00:00:07.396450,0.001,0.0001,linear,1000.0,,7.377,COMPLETE,PA
652,0.0,10.0,2026-07-23 15:47:16.523728,2026-07-23 15:47:24.293378,0 days 00:00:07.769650,10.0,1.0,geometric,1000.0,,7.685,COMPLETE,PA
653,0.0,10.0,2026-07-23 15:47:16.619968,2026-07-23 15:47:24.178958,0 days 00:00:07.558990,10000.0,1000.0,linear,0.001,,7.532,COMPLETE,PA
654,0.0,10.0,2026-07-23 15:47:16.773310,2026-07-23 15:47:16.796466,0 days 00:00:00.023156,0.0001,1000.0,geometric,1000.0,,0.0,COMPLETE,PA
655,0.0,10.0,2026-07-23 15:47:16.802015,2026-07-23 15:47:24.370381,0 days 00:00:07.568366,0.01,0.001,linear,10000.0,,7.54,COMPLETE,PA
656,0.0,10.0,2026-07-23 15:47:16.922655,2026-07-23 15:47:24.409484,0 days 00:00:07.486829,100.0,0.1,geometric,100.0,,7.457,COMPLETE,PA
657,0.0,10.0,2026-07-23 15:47:16.960301,2026-07-23 15:47:16.985647,0 days 00:00:00.025346,0.001,1000.0,geometric,0.0001,,0.0,COMPLETE,PA
658,0.0,10.0,2026-07-23 15:47:16.985811,2026-07-23 15:47:17.005871,0 days 00:00:00.020060,0.1,1000.0,linear,100.0,,0.0,COMPLETE,PA
659,0.0,10.0,2026-07-23 15:47:17.006791,2026-07-23 15:47:17.032022,0 days 00:00:00.025231,0.1,10000.0,geometric,0.0001,,0.0,COMPLETE,PA
660,0.0,10.0,2026-07-23 15:47:17.032168,2026-07-23 15:47:24.624157,0 days 00:00:07.591989,10000.0,0.01,geometric,0.0001,,7.567,COMPLETE,PA
661,0.0,10.0,2026-07-23 15:47:17.176404,2026-07-23 15:47:24.777626,0 days 00:00:07.601222,10000.0,1000.0,linear,10.0,,7.575,COMPLETE,PA
662,0.0,10.0,2026-07-23 15:47:22.720274,2026-07-23 15:47:22.745037,0 days 00:00:00.024763,0.001,10000.0,linear,10.0,,0.0,COMPLETE,PA
663,0.0,10.0,2026-07-23 15:47:22.745838,2026-07-23 15:47:22.769794,0 days 00:00:00.023956,0.1,1000.0,linear,1.0,,0.0,COMPLETE,PA
664,0.0,10.0,2026-07-23 15:47:22.772790,2026-07-23 15:47:30.274039,0 days 00:00:07.501249,10000.0,0.001,linear,0.0001,,7.484,COMPLETE,PA
665,0.0,10.0,2026-07-23 15:47:23.207044,2026-07-23 15:47:23.228624,0 days 00:00:00.021580,100.0,10000.0,linear,10000.0,,0.0,COMPLETE,PA
666,0.0,10.0,2026-07-23 15:47:23.231257,2026-07-23 15:47:23.255016,0 days 00:00:00.023759,1.0,1000.0,linear,1.0,,0.0,COMPLETE,PA
667,0.0,10.0,2026-07-23 15:47:23.260304,2026-07-23 15:47:23.278740,0 days 00:00:00.018436,0.001,0.1,linear,1000.0,,0.0,COMPLETE,PA
668,0.0,10.0,2026-07-23 15:47:23.281823,2026-07-23 15:47:31.046700,0 days 00:00:07.764877,100.0,1.0,linear,0.001,,7.737,COMPLETE,PA
669,0.0,10.0,2026-07-23 15:47:23.831813,2026-07-23 15:47:31.344685,0 days 00:00:07.512872,0.1,0.01,geometric,0.1,,7.476,COMPLETE,PA
670,0.4,1.7692307692307692,2026-07-23 15:47:24.057039,2026-07-23 15:47:31.620229,0 days 00:00:07.563190,10000.0,1.0,geometric,0.001,230.0,7.538,COMPLETE,PA
671,0.0,10.0,2026-07-23 15:47:24.182549,2026-07-23 15:47:31.655848,0 days 00:00:07.473299,10000.0,1000.0,linear,0.01,,7.453,COMPLETE,PA
672,0.0,10.0,2026-07-23 15:47:24.298040,2026-07-23 15:47:24.319146,0 days 00:00:00.021106,0.001,0.01,geometric,100.0,,0.0,COMPLETE,PA
673,0.0,10.0,2026-07-23 15:47:24.328480,2026-07-23 15:47:32.177721,0 days 00:00:07.849241,100.0,10.0,geometric,0.001,,7.827,COMPLETE,PA
674,0.0,10.0,2026-07-23 15:47:24.372650,2026-07-23 15:47:24.392722,0 days 00:00:00.020072,0.0001,0.001,linear,10000.0,,0.0,COMPLETE,PA
675,0.4,1.5538461538461539,2026-07-23 15:47:24.401625,2026-07-23 15:47:31.865770,0 days 00:00:07.464145,10000.0,10.0,geometric,1000.0,202.0,7.441,COMPLETE,PA
676,0.0,10.0,2026-07-23 15:47:24.417322,2026-07-23 15:47:24.435999,0 days 00:00:00.018677,0.1,1000.0,geometric,10000.0,,0.0,COMPLETE,PA
677,0.0,10.0,2026-07-23 15:47:24.436179,2026-07-23 15:47:31.928748,0 days 00:00:07.492569,100.0,0.001,geometric,100.0,,7.471,COMPLETE,PA
678,0.0,10.0,2026-07-23 15:47:24.629734,2026-07-23 15:47:24.653881,0 days 00:00:00.024147,0.01,1000.0,linear,0.1,,0.0,COMPLETE,PA
679,0.0,10.0,2026-07-23 15:47:24.654044,2026-07-23 15:47:32.246016,0 days 00:00:07.591972,10.0,0.1,linear,100.0,,7.512,COMPLETE,PA
680,0.0,10.0,2026-07-23 15:47:24.778991,2026-07-23 15:47:24.806204,0 days 00:00:00.027213,0.01,10000.0,geometric,1.0,,0.0,COMPLETE,PA
681,0.0,10.0,2026-07-23 15:47:24.813343,2026-07-23 15:47:32.244315,0 days 00:00:07.430972,100.0,1.0,geometric,0.001,,7.412,COMPLETE,PA
682,0.0,10.0,2026-07-23 15:47:30.274194,2026-07-23 15:47:30.294848,0 days 00:00:00.020654,10.0,1000.0,linear,100.0,,0.0,COMPLETE,PA
683,0.4,1.7692307692307692,2026-07-23 15:47:30.296983,2026-07-23 15:47:38.142089,0 days 00:00:07.845106,10000.0,1.0,geometric,100.0,230.0,7.763,COMPLETE,PA
684,0.0,10.0,2026-07-23 15:47:31.047578,2026-07-23 15:47:38.949077,0 days 00:00:07.901499,10.0,0.001,linear,0.0001,,7.871,COMPLETE,PA
685,0.2,1.676923076923077,2026-07-23 15:47:31.344958,2026-07-23 15:47:39.419082,0 days 00:00:08.074124,1000.0,0.1,linear,0.0001,218.0,8.052,COMPLETE,PA
686,0.6,1.4692307692307693,2026-07-23 15:47:31.622330,2026-07-23 15:47:39.465367,0 days 00:00:07.843037,1000.0,100.0,geometric,10000.0,191.0,7.811,COMPLETE,PA
687,0.0,10.0,2026-07-23 15:47:31.657609,2026-07-23 15:47:39.574731,0 days 00:00:07.917122,0.1,0.01,linear,1.0,,7.897,COMPLETE,PA
688,0.0,10.0,2026-07-23 15:47:31.870818,2026-07-23 15:47:39.868107,0 days 00:00:07.997289,100.0,0.0001,linear,1.0,,7.975,COMPLETE,PA
689,0.0,10.0,2026-07-23 15:47:31.933654,2026-07-23 15:47:31.953188,0 days 00:00:00.019534,0.1,1.0,linear,1000.0,,0.0,COMPLETE,PA
690,0.0,10.0,2026-07-23 15:47:31.953365,2026-07-23 15:47:31.984198,0 days 00:00:00.030833,0.0001,1000.0,linear,10.0,,0.0,COMPLETE,PA
691,0.0,10.0,2026-07-23 15:47:31.984644,2026-07-23 15:47:40.118887,0 days 00:00:08.134243,100.0,1.0,geometric,1000.0,,8.104,COMPLETE,PA
692,0.0,10.0,2026-07-23 15:47:32.192413,2026-07-23 15:47:32.269504,0 days 00:00:00.077091,0.0001,1000.0,linear,0.0001,,0.0,COMPLETE,PA
693,0.0,10.0,2026-07-23 15:47:32.246053,2026-07-23 15:47:32.279310,0 days 00:00:00.033257,0.01,10000.0,linear,1.0,,0.0,COMPLETE,PA
694,0.0,10.0,2026-07-23 15:47:32.282105,2026-07-23 15:47:32.302377,0 days 00:00:00.020272,0.001,10000.0,geometric,0.0001,,0.0,COMPLETE,PA
695,0.0,10.0,2026-07-23 15:47:32.302443,2026-07-23 15:47:40.210496,0 days 00:00:07.908053,0.1,0.1,linear,10000.0,,7.801,COMPLETE,PA
696,0.0,10.0,2026-07-23 15:47:32.310514,2026-07-23 15:47:32.344095,0 days 00:00:00.033581,0.0001,1000.0,geometric,0.1,,0.0,COMPLETE,PA
697,0.0,10.0,2026-07-23 15:47:32.344174,2026-07-23 15:47:40.257500,0 days 00:00:07.913326,1.0,0.01,linear,0.0001,,7.851,COMPLETE,PA
698,0.0,10.0,2026-07-23 15:47:32.350081,2026-07-23 15:47:32.383440,0 days 00:00:00.033359,0.001,10000.0,linear,100.0,,0.0,COMPLETE,PA
699,0.0,10.0,2026-07-23 15:47:32.384548,2026-07-23 15:47:32.411977,0 days 00:00:00.027429,0.0001,10000.0,geometric,10000.0,,0.0,COMPLETE,PA
700,0.0,10.0,2026-07-23 15:47:32.426452,2026-07-23 15:47:32.456032,0 days 00:00:00.029580,0.1,1.0,linear,100.0,,0.0,COMPLETE,PA
701,0.4,1.623076923076923,2026-07-23 15:47:32.462220,2026-07-23 15:47:40.442529,0 days 00:00:07.980309,10000.0,0.1,geometric,1.0,211.0,7.943,COMPLETE,PA
702,0.0,10.0,2026-07-23 15:47:38.165411,2026-07-23 15:47:38.187034,0 days 00:00:00.021623,0.1,10.0,geometric,0.01,,0.0,COMPLETE,PA
703,0.0,10.0,2026-07-23 15:47:38.194268,2026-07-23 15:47:38.216068,0 days 00:00:00.021800,0.0001,0.1,geometric,1000.0,,0.0,COMPLETE,PA
704,0.0,10.0,2026-07-23 15:47:38.223569,2026-07-23 15:47:38.259797,0 days 00:00:00.036228,100.0,1000.0,linear,0.01,,0.0,COMPLETE,PA
705,0.0,10.0,2026-07-23 15:47:38.263766,2026-07-23 15:47:45.691875,0 days 00:00:07.428109,0.001,0.0001,geometric,0.1,,7.388,COMPLETE,PA
706,0.4,1.5692307692307692,2026-07-23 15:47:38.951375,2026-07-23 15:47:46.818822,0 days 00:00:07.867447,1000.0,1.0,geometric,0.1,204.0,7.845,COMPLETE,PA
707,0.0,10.0,2026-07-23 15:47:39.419304,2026-07-23 15:47:39.472764,0 days 00:00:00.053460,0.001,1.0,geometric,100.0,,0.0,COMPLETE,PA
708,0.0,10.0,2026-07-23 15:47:39.465547,2026-07-23 15:47:39.492673,0 days 00:00:00.027126,0.01,1000.0,linear,10000.0,,0.0,COMPLETE,PA
709,0.0,10.0,2026-07-23 15:47:39.483716,2026-07-23 15:47:39.505067,0 days 00:00:00.021351,0.001,100.0,geometric,100.0,,0.0,COMPLETE,PA
710,0.0,10.0,2026-07-23 15:47:39.505117,2026-07-23 15:47:39.524143,0 days 00:00:00.019026,0.01,10.0,geometric,0.01,,0.0,COMPLETE,PA
711,0.0,10.0,2026-07-23 15:47:39.524198,2026-07-23 15:47:47.251935,0 days 00:00:07.727737,100.0,1.0,geometric,0.01,,7.692,COMPLETE,PA
712,0.0,10.0,2026-07-23 15:47:39.540711,2026-07-23 15:47:39.561555,0 days 00:00:00.020844,0.001,100.0,linear,1000.0,,0.0,COMPLETE,PA
713,0.0,10.0,2026-07-23 15:47:39.574769,2026-07-23 15:47:39.607605,0 days 00:00:00.032836,0.0001,0.001,geometric,10.0,,0.0,COMPLETE,PA
714,0.0,10.0,2026-07-23 15:47:39.578454,2026-07-23 15:47:39.619758,0 days 00:00:00.041304,0.001,0.01,geometric,10.0,,0.0,COMPLETE,PA
715,0.0,10.0,2026-07-23 15:47:39.619824,2026-07-23 15:47:39.652005,0 days 00:00:00.032181,0.0001,0.001,geometric,0.1,,0.0,COMPLETE,PA
716,0.0,10.0,2026-07-23 15:47:39.620749,2026-07-23 15:47:47.253728,0 days 00:00:07.632979,10.0,10.0,geometric,0.001,,7.61,COMPLETE,PA
717,0.2,1.7538461538461538,2026-07-23 15:47:39.652152,2026-07-23 15:47:47.301800,0 days 00:00:07.649648,1000.0,100.0,linear,0.1,228.0,7.623,COMPLETE,PA
718,0.0,10.0,2026-07-23 15:47:39.872180,2026-07-23 15:47:39.895262,0 days 00:00:00.023082,0.0001,1000.0,linear,0.1,,0.0,COMPLETE,PA
719,0.0,10.0,2026-07-23 15:47:39.898286,2026-07-23 15:47:39.923158,0 days 00:00:00.024872,0.01,0.1,linear,10000.0,,0.0,COMPLETE,PA
720,0.0,10.0,2026-07-23 15:47:39.925742,2026-07-23 15:47:39.950745,0 days 00:00:00.025003,0.001,0.1,linear,10.0,,0.0,COMPLETE,PA
721,0.0,10.0,2026-07-23 15:47:39.950873,2026-07-23 15:47:47.581967,0 days 00:00:07.631094,1.0,0.1,geometric,10000.0,,7.609,COMPLETE,PA
722,0.0,10.0,2026-07-23 15:47:40.124869,2026-07-23 15:47:47.741817,0 days 00:00:07.616948,100.0,100.0,geometric,10000.0,,7.592,COMPLETE,PA
723,0.6,1.7230769230769232,2026-07-23 15:47:40.213645,2026-07-23 15:47:47.772627,0 days 00:00:07.558982,10000.0,0.001,geometric,100.0,224.0,7.518,COMPLETE,PA
724,0.0,10.0,2026-07-23 15:47:40.258121,2026-07-23 15:47:40.286081,0 days 00:00:00.027960,0.001,100.0,linear,10000.0,,0.0,COMPLETE,PA
725,0.0,10.0,2026-07-23 15:47:40.288962,2026-07-23 15:47:47.869555,0 days 00:00:07.580593,0.001,0.0001,linear,0.01,,7.553,COMPLETE,PA
726,0.0,10.0,2026-07-23 15:47:40.443814,2026-07-23 15:47:40.514582,0 days 00:00:00.070768,0.0001,0.01,linear,0.1,,0.0,COMPLETE,PA
727,0.0,10.0,2026-07-23 15:47:40.517757,2026-07-23 15:47:40.542137,0 days 00:00:00.024380,1.0,1000.0,linear,0.1,,0.0,COMPLETE,PA
728,0.0,10.0,2026-07-23 15:47:40.551127,2026-07-23 15:47:48.050536,0 days 00:00:07.499409,0.01,0.001,geometric,0.0001,,7.469,COMPLETE,PA
729,0.0,10.0,2026-07-23 15:47:45.693747,2026-07-23 15:47:45.712057,0 days 00:00:00.018310,0.1,10000.0,geometric,10000.0,,0.0,COMPLETE,PA
730,0.0,10.0,2026-07-23 15:47:45.731972,2026-07-23 15:47:53.063172,0 days 00:00:07.331200,10000.0,10000.0,linear,0.01,,7.295,COMPLETE,PA
731,0.0,10.0,2026-07-23 15:47:46.822296,2026-07-23 15:47:54.351370,0 days 00:00:07.529074,10000.0,0.0001,linear,0.001,,7.501,COMPLETE,PA
732,0.0,10.0,2026-07-23 15:47:47.253849,2026-07-23 15:47:47.301036,0 days 00:00:00.047187,0.001,1000.0,geometric,0.1,,0.0,COMPLETE,PA
733,0.0,10.0,2026-07-23 15:47:47.275374,2026-07-23 15:47:54.801471,0 days 00:00:07.526097,1.0,0.1,linear,1.0,,7.495,COMPLETE,PA
734,0.0,10.0,2026-07-23 15:47:47.303052,2026-07-23 15:47:47.345659,0 days 00:00:00.042607,10.0,1000.0,linear,1000.0,,0.0,COMPLETE,PA
735,0.0,10.0,2026-07-23 15:47:47.312187,2026-07-23 15:47:54.727389,0 days 00:00:07.415202,100.0,0.1,geometric,0.0001,,7.388,COMPLETE,PA
736,0.0,10.0,2026-07-23 15:47:47.352503,2026-07-23 15:47:47.375198,0 days 00:00:00.022695,0.01,10000.0,linear,10000.0,,0.0,COMPLETE,PA
737,0.0,10.0,2026-07-23 15:47:47.384173,2026-07-23 15:47:54.798614,0 days 00:00:07.414441,10.0,0.1,linear,10000.0,,7.383,COMPLETE,PA
738,0.0,10.0,2026-07-23 15:47:47.591640,2026-07-23 15:47:47.622890,0 days 00:00:00.031250,100.0,1000.0,geometric,1.0,,0.0,COMPLETE,PA
739,0.2,1.7538461538461538,2026-07-23 15:47:47.625737,2026-07-23 15:47:55.334723,0 days 00:00:07.708986,1000.0,100.0,linear,100.0,228.0,7.602,COMPLETE,PA
740,0.0,10.0,2026-07-23 15:47:47.758830,2026-07-23 15:47:55.143247,0 days 00:00:07.384417,0.0001,0.0001,linear,10.0,,7.362,COMPLETE,PA
741,0.2,1.7230769230769232,2026-07-23 15:47:47.777830,2026-07-23 15:47:55.283857,0 days 00:00:07.506027,1000.0,10.0,geometric,0.1,224.0,7.419,COMPLETE,PA
742,0.0,10.0,2026-07-23 15:47:47.874435,2026-07-23 15:47:47.918249,0 days 00:00:00.043814,0.1,10000.0,linear,0.0001,,0.0,COMPLETE,PA
743,0.0,10.0,2026-07-23 15:47:47.919778,2026-07-23 15:47:47.954025,0 days 00:00:00.034247,0.01,100.0,geometric,10.0,,0.0,COMPLETE,PA
744,0.0,10.0,2026-07-23 15:47:47.954241,2026-07-23 15:47:55.533252,0 days 00:00:07.579011,1.0,1.0,geometric,0.0001,,7.548,COMPLETE,PA
745,0.0,10.0,2026-07-23 15:47:48.050715,2026-07-23 15:47:48.077681,0 days 00:00:00.026966,0.01,10000.0,linear,1000.0,,0.0,COMPLETE,PA
746,0.0,10.0,2026-07-23 15:47:48.078634,2026-07-23 15:47:55.577964,0 days 00:00:07.499330,10.0,10.0,linear,100.0,,7.464,COMPLETE,PA
747,0.0,10.0,2026-07-23 15:47:53.068539,2026-07-23 15:48:00.645472,0 days 00:00:07.576933,1.0,0.01,linear,1000.0,,7.55,COMPLETE,PA
748,0.0,10.0,2026-07-23 15:47:54.358945,2026-07-23 15:48:01.763555,0 days 00:00:07.404610,100.0,0.0001,geometric,0.0001,,7.371,COMPLETE,PA
749,0.0,10.0,2026-07-23 15:47:54.737975,2026-07-23 15:47:54.756720,0 days 00:00:00.018745,0.1,10.0,geometric,1000.0,,0.0,COMPLETE,PA
750,0.0,10.0,2026-07-23 15:47:54.759407,2026-07-23 15:48:02.447880,0 days 00:00:07.688473,100.0,1.0,linear,10.0,,7.668,COMPLETE,PA
751,0.0,10.0,2026-07-23 15:47:54.801625,2026-07-23 15:47:54.837118,0 days 00:00:00.035493,0.0001,1.0,geometric,10.0,,0.0,COMPLETE,PA
752,0.0,10.0,2026-07-23 15:47:54.807881,2026-07-23 15:48:02.476860,0 days 00:00:07.668979,0.01,0.001,linear,1.0,,7.619,COMPLETE,PA
753,0.0,10.0,2026-07-23 15:47:54.837284,2026-07-23 15:48:02.378020,0 days 00:00:07.540736,10000.0,0.01,geometric,0.01,,7.518,COMPLETE,PA
754,0.0,10.0,2026-07-23 15:47:55.146599,2026-07-23 15:47:55.182455,0 days 00:00:00.035856,0.01,1000.0,geometric,1000.0,,0.0,COMPLETE,PA
755,0.0,10.0,2026-07-23 15:47:55.183990,2026-07-23 15:47:55.205473,0 days 00:00:00.021483,0.01,1000.0,linear,1000.0,,0.0,COMPLETE,PA
756,0.0,10.0,2026-07-23 15:47:55.208559,2026-07-23 15:47:55.289241,0 days 00:00:00.080682,0.001,0.1,geometric,0.01,,0.0,COMPLETE,PA
757,0.0,10.0,2026-07-23 15:47:55.289285,2026-07-23 15:48:02.604842,0 days 00:00:07.315557,10000.0,0.01,linear,10.0,,7.287,COMPLETE,PA
758,0.0,10.0,2026-07-23 15:47:55.307191,2026-07-23 15:47:55.328267,0 days 00:00:00.021076,0.0001,10.0,linear,100.0,,0.0,COMPLETE,PA
759,0.0,10.0,2026-07-23 15:47:55.338398,2026-07-23 15:47:55.385146,0 days 00:00:00.046748,0.01,1000.0,geometric,1.0,,0.0,COMPLETE,PA
760,0.0,10.0,2026-07-23 15:47:55.349972,2026-07-23 15:48:02.859450,0 days 00:00:07.509478,1.0,0.1,linear,1000.0,,7.486,COMPLETE,PA
761,0.0,10.0,2026-07-23 15:47:55.392512,2026-07-23 15:47:55.418150,0 days 00:00:00.025638,0.001,0.01,linear,0.1,,0.0,COMPLETE,PA
762,0.0,10.0,2026-07-23 15:47:55.422489,2026-07-23 15:47:55.446269,0 days 00:00:00.023780,0.0001,10000.0,geometric,0.1,,0.0,COMPLETE,PA
763,0.0,10.0,2026-07-23 15:47:55.447800,2026-07-23 15:47:55.475325,0 days 00:00:00.027525,100.0,10000.0,geometric,0.1,,0.0,COMPLETE,PA
764,0.0,10.0,2026-07-23 15:47:55.478861,2026-07-23 15:47:55.498332,0 days 00:00:00.019471,0.001,100.0,geometric,1000.0,,0.0,COMPLETE,PA
765,0.0,10.0,2026-07-23 15:47:55.498902,2026-07-23 15:48:03.049636,0 days 00:00:07.550734,0.01,0.01,geometric,0.01,,7.524,COMPLETE,PA
766,0.0,10.0,2026-07-23 15:47:55.541595,2026-07-23 15:48:03.204969,0 days 00:00:07.663374,100.0,1.0,geometric,0.0001,,7.632,COMPLETE,PA
767,0.0,10.0,2026-07-23 15:47:55.585284,2026-07-23 15:48:03.283316,0 days 00:00:07.698032,100.0,100.0,linear,0.0001,,7.667,COMPLETE,PA
768,0.0,10.0,2026-07-23 15:48:00.651276,2026-07-23 15:48:08.161655,0 days 00:00:07.510379,100.0,1.0,linear,0.01,,7.486,COMPLETE,PA
769,0.0,10.0,2026-07-23 15:48:01.763877,2026-07-23 15:48:09.357985,0 days 00:00:07.594108,10.0,1.0,geometric,0.1,,7.569,COMPLETE,PA
770,0.4,1.7692307692307692,2026-07-23 15:48:02.381441,2026-07-23 15:48:10.181896,0 days 00:00:07.800455,10000.0,1.0,geometric,0.0001,230.0,7.769,COMPLETE,PA
771,0.0,10.0,2026-07-23 15:48:02.465083,2026-07-23 15:48:09.856764,0 days 00:00:07.391681,0.1,0.0001,geometric,0.0001,,7.368,COMPLETE,PA
772,0.0,10.0,2026-07-23 15:48:02.485340,2026-07-23 15:48:10.234269,0 days 00:00:07.748929,10.0,0.001,linear,10.0,,7.723,COMPLETE,PA
773,0.0,10.0,2026-07-23 15:48:02.615962,2026-07-23 15:48:02.641046,0 days 00:00:00.025084,0.01,10.0,linear,10000.0,,0.0,COMPLETE,PA
774,0.4,1.623076923076923,2026-07-23 15:48:02.647729,2026-07-23 15:48:10.381625,0 days 00:00:07.733896,10000.0,0.1,geometric,10000.0,211.0,7.706,COMPLETE,PA
775,0.0,10.0,2026-07-23 15:48:02.861853,2026-07-23 15:48:02.887178,0 days 00:00:00.025325,1.0,100.0,geometric,1.0,,0.0,COMPLETE,PA
776,0.0,10.0,2026-07-23 15:48:02.888786,2026-07-23 15:48:10.511834,0 days 00:00:07.623048,100.0,10.0,linear,0.1,,7.596,COMPLETE,PA
777,0.2,1.676923076923077,2026-07-23 15:48:03.051727,2026-07-23 15:48:10.661333,0 days 00:00:07.609606,1000.0,0.1,linear,1.0,218.0,7.581,COMPLETE,PA
778,0.0,10.0,2026-07-23 15:48:03.211111,2026-07-23 15:48:03.235909,0 days 00:00:00.024798,10.0,1000.0,geometric,0.0001,,0.0,COMPLETE,PA
779,0.0,10.0,2026-07-23 15:48:03.237331,2026-07-23 15:48:03.271423,0 days 00:00:00.034092,0.01,1.0,linear,100.0,,0.0,COMPLETE,PA
780,0.0,10.0,2026-07-23 15:48:03.285754,2026-07-23 15:48:03.328546,0 days 00:00:00.042792,0.01,10000.0,geometric,10.0,,0.0,COMPLETE,PA
781,0.0,10.0,2026-07-23 15:48:03.295277,2026-07-23 15:48:10.881511,0 days 00:00:07.586234,10000.0,1000.0,geometric,1000.0,,7.561,COMPLETE,PA
782,0.0,10.0,2026-07-23 15:48:03.339897,2026-07-23 15:48:10.779728,0 days 00:00:07.439831,10000.0,0.001,linear,0.001,,7.407,COMPLETE,PA
783,0.0,10.0,2026-07-23 15:48:08.166024,2026-07-23 15:48:08.197124,0 days 00:00:00.031100,0.001,0.1,geometric,1000.0,,0.0,COMPLETE,PA
784,0.0,10.0,2026-07-23 15:48:08.202535,2026-07-23 15:48:08.226950,0 days 00:00:00.024415,1.0,10000.0,linear,10.0,,0.0,COMPLETE,PA
785,0.0,10.0,2026-07-23 15:48:08.234839,2026-07-23 15:48:08.266999,0 days 00:00:00.032160,0.01,1000.0,geometric,100.0,,0.0,COMPLETE,PA
786,0.0,10.0,2026-07-23 15:48:08.270373,2026-07-23 15:48:15.855475,0 days 00:00:07.585102,10.0,0.01,linear,1.0,,7.555,COMPLETE,PA
787,0.0,10.0,2026-07-23 15:48:09.362782,2026-07-23 15:48:09.394099,0 days 00:00:00.031317,100.0,10000.0,linear,0.0001,,0.0,COMPLETE,PA
788,0.0,10.0,2026-07-23 15:48:09.395382,2026-07-23 15:48:09.421119,0 days 00:00:00.025737,100.0,10000.0,linear,0.001,,0.0,COMPLETE,PA
789,0.0,10.0,2026-07-23 15:48:09.424887,2026-07-23 15:48:09.446061,0 days 00:00:00.021174,1.0,100.0,linear,0.001,,0.0,COMPLETE,PA
790,0.0,10.0,2026-07-23 15:48:09.455537,2026-07-23 15:48:17.208261,0 days 00:00:07.752724,0.1,0.1,geometric,0.0001,,7.726,COMPLETE,PA
791,0.0,10.0,2026-07-23 15:48:09.859119,2026-07-23 15:48:17.349208,0 days 00:00:07.490089,10.0,0.001,geometric,10000.0,,7.459,COMPLETE,PA
792,0.0,10.0,2026-07-23 15:48:10.185842,2026-07-23 15:48:17.681151,0 days 00:00:07.495309,10000.0,1000.0,linear,1000.0,,7.467,COMPLETE,PA
793,0.0,10.0,2026-07-23 15:48:10.234462,2026-07-23 15:48:17.634972,0 days 00:00:07.400510,1.0,0.1,geometric,1000.0,,7.372,COMPLETE,PA
794,0.0,10.0,2026-07-23 15:48:10.389584,2026-07-23 15:48:10.419328,0 days 00:00:00.029744,1.0,1000.0,linear,0.01,,0.0,COMPLETE,PA
795,0.4,1.5846153846153845,2026-07-23 15:48:10.424228,2026-07-23 15:48:17.908391,0 days 00:00:07.484163,1000.0,10.0,linear,0.01,206.0,7.454,COMPLETE,PA
796,0.0,10.0,2026-07-23 15:48:10.512427,2026-07-23 15:48:10.539665,0 days 00:00:00.027238,1.0,10000.0,linear,0.0001,,0.0,COMPLETE,PA
797,0.0,10.0,2026-07-23 15:48:10.541187,2026-07-23 15:48:17.978216,0 days 00:00:07.437029,0.001,0.001,geometric,0.0001,,7.366,COMPLETE,PA
798,0.2,1.7538461538461538,2026-07-23 15:48:10.669735,2026-07-23 15:48:18.105549,0 days 00:00:07.435814,1000.0,100.0,linear,10000.0,228.0,7.408,COMPLETE,PA
