number,values_0,values_1,datetime_start,datetime_complete,duration,params_beta_max,params_beta_min,params_beta_schedule_type,params_gamma,user_attrs_best_cost,user_attrs_time_s,state,solver
799,0.0,10.0,2026-07-23 15:48:10.781241,2026-07-23 15:48:10.807859,0 days 00:00:00.026618,0.01,0.1,linear,0.01,,0.0,COMPLETE,PA
800,0.0,10.0,2026-07-23 15:48:10.809297,2026-07-23 15:48:10.829150,0 days 00:00:00.019853,10.0,100.0,geometric,0.001,,0.0,COMPLETE,PA
801,0.0,10.0,2026-07-23 15:48:10.829342,2026-07-23 15:48:18.354423,0 days 00:00:07.525081,10000.0,0.1,linear,0.01,,7.501,COMPLETE,PA
802,0.6,1.676923076923077,2026-07-23 15:48:10.887071,2026-07-23 15:48:18.293705,0 days 00:00:07.406634,1000.0,0.001,linear,10000.0,218.0,7.373,COMPLETE,PA
803,0.0,10.0,2026-07-23 15:48:15.860352,2026-07-23 15:48:15.887241,0 days 00:00:00.026889,0.1,10000.0,geometric,1.0,,0.0,COMPLETE,PA
804,0.0,10.0,2026-07-23 15:48:15.893946,2026-07-23 15:48:15.919860,0 days 00:00:00.025914,10.0,100.0,linear,10.0,,0.0,COMPLETE,PA
805,0.0,10.0,2026-07-23 15:48:15.927361,2026-07-23 15:48:23.292051,0 days 00:00:07.364690,0.01,0.001,linear,100.0,,7.338,COMPLETE,PA
806,0.0,10.0,2026-07-23 15:48:17.214479,2026-07-23 15:48:24.486463,0 days 00:00:07.271984,10000.0,0.0001,linear,0.01,,7.247,COMPLETE,PA
807,0.0,10.0,2026-07-23 15:48:17.351463,2026-07-23 15:48:24.660750,0 days 00:00:07.309287,0.1,0.001,linear,10000.0,,7.287,COMPLETE,PA
808,0.0,10.0,2026-07-23 15:48:17.637706,2026-07-23 15:48:17.676965,0 days 00:00:00.039259,0.0001,0.01,geometric,0.01,,0.0,COMPLETE,PA
809,0.0,10.0,2026-07-23 15:48:17.681223,2026-07-23 15:48:17.708318,0 days 00:00:00.027095,100.0,10000.0,linear,1.0,,0.0,COMPLETE,PA
810,0.0,10.0,2026-07-23 15:48:17.712722,2026-07-23 15:48:25.075424,0 days 00:00:07.362702,0.1,0.1,linear,0.0001,,7.324,COMPLETE,PA
811,0.6,1.676923076923077,2026-07-23 15:48:17.722725,2026-07-23 15:48:25.472767,0 days 00:00:07.750042,1000.0,0.001,linear,1.0,218.0,7.727,COMPLETE,PA
812,0.0,10.0,2026-07-23 15:48:17.908578,2026-07-23 15:48:17.935413,0 days 00:00:00.026835,100.0,1000.0,geometric,10.0,,0.0,COMPLETE,PA
813,0.0,10.0,2026-07-23 15:48:17.936019,2026-07-23 15:48:25.407142,0 days 00:00:07.471123,100.0,1.0,geometric,1.0,,7.445,COMPLETE,PA
814,0.0,10.0,2026-07-23 15:48:17.986790,2026-07-23 15:48:25.544831,0 days 00:00:07.558041,0.01,0.0001,geometric,0.1,,7.531,COMPLETE,PA
815,0.0,10.0,2026-07-23 15:48:18.109186,2026-07-23 15:48:18.142188,0 days 00:00:00.033002,0.001,1000.0,geometric,100.0,,0.0,COMPLETE,PA
816,0.0,10.0,2026-07-23 15:48:18.142358,2026-07-23 15:48:18.169731,0 days 00:00:00.027373,0.001,1.0,linear,100.0,,0.0,COMPLETE,PA
817,0.0,10.0,2026-07-23 15:48:18.170470,2026-07-23 15:48:18.196982,0 days 00:00:00.026512,0.01,1000.0,linear,100.0,,0.0,COMPLETE,PA
818,0.0,10.0,2026-07-23 15:48:18.198401,2026-07-23 15:48:25.652593,0 days 00:00:07.454192,1000.0,1000.0,linear,0.01,,7.426,COMPLETE,PA
819,0.0,10.0,2026-07-23 15:48:18.296721,2026-07-23 15:48:25.931613,0 days 00:00:07.634892,100.0,0.0001,geometric,0.001,,7.557,COMPLETE,PA
820,0.0,10.0,2026-07-23 15:48:18.362949,2026-07-23 15:48:18.384911,0 days 00:00:00.021962,0.0001,0.01,linear,10000.0,,0.0,COMPLETE,PA
821,0.0,10.0,2026-07-23 15:48:18.389946,2026-07-23 15:48:18.417351,0 days 00:00:00.027405,1.0,10.0,linear,0.1,,0.0,COMPLETE,PA
822,0.0,10.0,2026-07-23 15:48:18.427791,2026-07-23 15:48:25.830354,0 days 00:00:07.402563,10.0,10.0,geometric,0.0001,,7.373,COMPLETE,PA
823,0.0,10.0,2026-07-23 15:48:23.294829,2026-07-23 15:48:23.320500,0 days 00:00:00.025671,100.0,1000.0,geometric,0.1,,0.0,COMPLETE,PA
824,0.0,10.0,2026-07-23 15:48:23.324200,2026-07-23 15:48:23.350281,0 days 00:00:00.026081,1000.0,10000.0,linear,0.001,,0.0,COMPLETE,PA
825,0.0,10.0,2026-07-23 15:48:23.356472,2026-07-23 15:48:23.384732,0 days 00:00:00.028260,1.0,100.0,linear,10.0,,0.0,COMPLETE,PA
826,0.0,10.0,2026-07-23 15:48:23.388650,2026-07-23 15:48:23.423001,0 days 00:00:00.034351,0.1,1000.0,linear,0.01,,0.0,COMPLETE,PA
827,0.0,10.0,2026-07-23 15:48:23.428969,2026-07-23 15:48:23.453636,0 days 00:00:00.024667,0.1,10.0,geometric,0.1,,0.0,COMPLETE,PA
828,0.0,10.0,2026-07-23 15:48:23.458312,2026-07-23 15:48:30.884892,0 days 00:00:07.426580,0.1,0.001,linear,10.0,,7.402,COMPLETE,PA
829,0.0,10.0,2026-07-23 15:48:24.496054,2026-07-23 15:48:32.140628,0 days 00:00:07.644574,0.1,0.1,linear,0.01,,7.613,COMPLETE,PA
830,0.2,1.676923076923077,2026-07-23 15:48:24.660964,2026-07-23 15:48:32.164156,0 days 00:00:07.503192,1000.0,0.1,linear,0.01,218.0,7.47,COMPLETE,PA
831,0.0,10.0,2026-07-23 15:48:25.081371,2026-07-23 15:48:32.429011,0 days 00:00:07.347640,10000.0,0.0001,linear,0.0001,,7.315,COMPLETE,PA
832,0.0,10.0,2026-07-23 15:48:25.407315,2026-07-23 15:48:32.888220,0 days 00:00:07.480905,0.01,0.0001,geometric,1000.0,,7.452,COMPLETE,PA
833,0.0,10.0,2026-07-23 15:48:25.474105,2026-07-23 15:48:32.799938,0 days 00:00:07.325833,0.0001,0.0001,linear,10000.0,,7.302,COMPLETE,PA
834,0.0,10.0,2026-07-23 15:48:25.545748,2026-07-23 15:48:25.576731,0 days 00:00:00.030983,0.0001,0.1,linear,0.0001,,0.0,COMPLETE,PA
835,0.0,10.0,2026-07-23 15:48:25.580820,2026-07-23 15:48:25.600763,0 days 00:00:00.019943,0.001,0.01,linear,10.0,,0.0,COMPLETE,PA
836,0.0,10.0,2026-07-23 15:48:25.606976,2026-07-23 15:48:33.163184,0 days 00:00:07.556208,100.0,100.0,linear,100.0,,7.528,COMPLETE,PA
837,0.0,10.0,2026-07-23 15:48:25.655809,2026-07-23 15:48:25.689222,0 days 00:00:00.033413,0.0001,0.01,linear,10.0,,0.0,COMPLETE,PA
838,0.0,10.0,2026-07-23 15:48:25.695371,2026-07-23 15:48:25.724917,0 days 00:00:00.029546,0.001,10.0,geometric,0.1,,0.0,COMPLETE,PA
839,0.0,10.0,2026-07-23 15:48:25.725115,2026-07-23 15:48:25.767544,0 days 00:00:00.042429,1.0,10.0,geometric,0.1,,0.0,COMPLETE,PA
840,0.0,10.0,2026-07-23 15:48:25.769441,2026-07-23 15:48:25.794376,0 days 00:00:00.024935,0.001,10.0,geometric,0.0001,,0.0,COMPLETE,PA
841,0.0,10.0,2026-07-23 15:48:25.794538,2026-07-23 15:48:25.825862,0 days 00:00:00.031324,0.001,10000.0,linear,0.001,,0.0,COMPLETE,PA
842,0.0,10.0,2026-07-23 15:48:25.830506,2026-07-23 15:48:25.918286,0 days 00:00:00.087780,1.0,10.0,geometric,0.01,,0.0,COMPLETE,PA
843,0.0,10.0,2026-07-23 15:48:25.836287,2026-07-23 15:48:33.427386,0 days 00:00:07.591099,0.001,0.0001,linear,0.1,,7.481,COMPLETE,PA
844,0.0,10.0,2026-07-23 15:48:25.931662,2026-07-23 15:48:25.958746,0 days 00:00:00.027084,0.1,1000.0,linear,0.1,,0.0,COMPLETE,PA
845,0.0,10.0,2026-07-23 15:48:25.958804,2026-07-23 15:48:33.431831,0 days 00:00:07.473027,0.01,0.01,linear,10000.0,,7.437,COMPLETE,PA
846,0.0,10.0,2026-07-23 15:48:25.985164,2026-07-23 15:48:26.010244,0 days 00:00:00.025080,0.0001,10.0,linear,10000.0,,0.0,COMPLETE,PA
847,0.6,1.7,2026-07-23 15:48:26.020876,2026-07-23 15:48:33.730331,0 days 00:00:07.709455,1000.0,0.0001,linear,10000.0,221.0,7.671,COMPLETE,PA
848,0.0,10.0,2026-07-23 15:48:30.886390,2026-07-23 15:48:38.495181,0 days 00:00:07.608791,10000.0,0.0001,linear,0.1,,7.582,COMPLETE,PA
849,0.4,1.5692307692307692,2026-07-23 15:48:32.154674,2026-07-23 15:48:39.845261,0 days 00:00:07.690587,1000.0,1.0,geometric,0.001,204.0,7.635,COMPLETE,PA
850,0.0,10.0,2026-07-23 15:48:32.170027,2026-07-23 15:48:39.727931,0 days 00:00:07.557904,10000.0,100.0,linear,1.0,,7.53,COMPLETE,PA
851,0.4,1.5846153846153845,2026-07-23 15:48:32.432879,2026-07-23 15:48:40.031459,0 days 00:00:07.598580,1000.0,10.0,linear,100.0,206.0,7.567,COMPLETE,PA
852,0.0,10.0,2026-07-23 15:48:32.800343,2026-07-23 15:48:32.830008,0 days 00:00:00.029665,0.001,10.0,linear,10.0,,0.0,COMPLETE,PA
853,0.4,1.7692307692307692,2026-07-23 15:48:32.830563,2026-07-23 15:48:40.424770,0 days 00:00:07.594207,10000.0,1.0,geometric,1000.0,230.0,7.566,COMPLETE,PA
854,0.0,10.0,2026-07-23 15:48:32.894498,2026-07-23 15:48:40.565482,0 days 00:00:07.670984,100.0,0.0001,linear,1000.0,,7.642,COMPLETE,PA
855,0.0,10.0,2026-07-23 15:48:33.170077,2026-07-23 15:48:33.193837,0 days 00:00:00.023760,1.0,10000.0,linear,1000.0,,0.0,COMPLETE,PA
856,0.0,10.0,2026-07-23 15:48:33.195944,2026-07-23 15:48:33.223655,0 days 00:00:00.027711,1.0,100.0,geometric,0.1,,0.0,COMPLETE,PA
857,0.0,10.0,2026-07-23 15:48:33.227807,2026-07-23 15:48:33.257339,0 days 00:00:00.029532,10.0,100.0,geometric,0.0001,,0.0,COMPLETE,PA
858,0.0,10.0,2026-07-23 15:48:33.257532,2026-07-23 15:48:41.058900,0 days 00:00:07.801368,0.01,0.01,linear,0.1,,7.77,COMPLETE,PA
859,0.0,10.0,2026-07-23 15:48:33.431889,2026-07-23 15:48:33.465097,0 days 00:00:00.033208,0.001,10.0,geometric,10000.0,,0.0,COMPLETE,PA
860,0.2,1.7153846153846153,2026-07-23 15:48:33.455677,2026-07-23 15:48:41.141783,0 days 00:00:07.686106,1000.0,0.1,geometric,0.1,223.0,7.635,COMPLETE,PA
861,0.0,10.0,2026-07-23 15:48:33.475688,2026-07-23 15:48:33.503682,0 days 00:00:00.027994,0.1,10.0,geometric,10000.0,,0.0,COMPLETE,PA
862,0.0,10.0,2026-07-23 15:48:33.507056,2026-07-23 15:48:33.531299,0 days 00:00:00.024243,0.001,10.0,geometric,0.01,,0.0,COMPLETE,PA
863,0.0,10.0,2026-07-23 15:48:33.538054,2026-07-23 15:48:33.565710,0 days 00:00:00.027656,0.0001,0.1,linear,10.0,,0.0,COMPLETE,PA
864,0.0,10.0,2026-07-23 15:48:33.569678,2026-07-23 15:48:41.249083,0 days 00:00:07.679405,100.0,0.001,linear,0.01,,7.627,COMPLETE,PA
865,0.0,10.0,2026-07-23 15:48:33.730981,2026-07-23 15:48:41.349620,0 days 00:00:07.618639,100.0,0.1,geometric,10.0,,7.557,COMPLETE,PA
866,0.0,10.0,2026-07-23 15:48:38.496863,2026-07-23 15:48:38.535621,0 days 00:00:00.038758,0.001,10.0,linear,1.0,,0.0,COMPLETE,PA
867,0.0,10.0,2026-07-23 15:48:38.535812,2026-07-23 15:48:38.564685,0 days 00:00:00.028873,0.001,1.0,linear,0.1,,0.0,COMPLETE,PA
868,0.0,10.0,2026-07-23 15:48:38.565919,2026-07-23 15:48:46.225778,0 days 00:00:07.659859,10000.0,1000.0,linear,10000.0,,7.622,COMPLETE,PA
869,0.0,10.0,2026-07-23 15:48:39.728109,2026-07-23 15:48:39.768854,0 days 00:00:00.040745,0.0001,1.0,geometric,0.1,,0.0,COMPLETE,PA
870,0.0,10.0,2026-07-23 15:48:39.774300,2026-07-23 15:48:39.799266,0 days 00:00:00.024966,0.001,0.1,linear,0.1,,0.0,COMPLETE,PA
871,0.0,10.0,2026-07-23 15:48:39.801910,2026-07-23 15:48:39.826976,0 days 00:00:00.025066,0.1,1000.0,linear,10000.0,,0.0,COMPLETE,PA
872,0.0,10.0,2026-07-23 15:48:39.845327,2026-07-23 15:48:39.954342,0 days 00:00:00.109015,0.1,1.0,geometric,0.1,,0.0,COMPLETE,PA
873,0.0,10.0,2026-07-23 15:48:39.886835,2026-07-23 15:48:39.964170,0 days 00:00:00.077335,0.0001,0.01,geometric,10000.0,,0.0,COMPLETE,PA
874,0.0,10.0,2026-07-23 15:48:39.954507,2026-07-23 15:48:47.770167,0 days 00:00:07.815660,100.0,0.1,linear,100.0,,7.786,COMPLETE,PA
875,0.0,10.0,2026-07-23 15:48:39.972575,2026-07-23 15:48:47.597672,0 days 00:00:07.625097,10000.0,10000.0,linear,10000.0,,7.589,COMPLETE,PA
876,0.0,10.0,2026-07-23 15:48:40.034145,2026-07-23 15:48:40.058925,0 days 00:00:00.024780,0.1,100.0,linear,1000.0,,0.0,COMPLETE,PA
877,0.0,10.0,2026-07-23 15:48:40.062677,2026-07-23 15:48:40.090743,0 days 00:00:00.028066,1.0,100.0,linear,100.0,,0.0,COMPLETE,PA
878,0.0,10.0,2026-07-23 15:48:40.092831,2026-07-23 15:48:40.118685,0 days 00:00:00.025854,0.0001,100.0,geometric,100.0,,0.0,COMPLETE,PA
879,0.0,10.0,2026-07-23 15:48:40.126581,2026-07-23 15:48:47.601591,0 days 00:00:07.475010,0.1,0.0001,linear,0.01,,7.44,COMPLETE,PA
880,0.0,10.0,2026-07-23 15:48:40.428163,2026-07-23 15:48:47.931074,0 days 00:00:07.502911,10.0,0.001,geometric,10.0,,7.473,COMPLETE,PA
881,0.0,10.0,2026-07-23 15:48:40.572111,2026-07-23 15:48:40.610449,0 days 00:00:00.038338,0.001,0.1,linear,10000.0,,0.0,COMPLETE,PA
882,0.0,10.0,2026-07-23 15:48:40.614584,2026-07-23 15:48:48.156316,0 days 00:00:07.541732,1.0,0.1,linear,10.0,,7.512,COMPLETE,PA
883,0.0,10.0,2026-07-23 15:48:41.066577,2026-07-23 15:48:41.102243,0 days 00:00:00.035666,1.0,10.0,geometric,10000.0,,0.0,COMPLETE,PA
884,0.0,10.0,2026-07-23 15:48:41.117703,2026-07-23 15:48:41.180415,0 days 00:00:00.062712,1000.0,10000.0,linear,1000.0,,0.0,COMPLETE,PA
885,0.0,10.0,2026-07-23 15:48:41.141952,2026-07-23 15:48:41.209667,0 days 00:00:00.067715,10.0,100.0,linear,1000.0,,0.0,COMPLETE,PA
886,0.0,10.0,2026-07-23 15:48:41.199854,2026-07-23 15:48:41.245824,0 days 00:00:00.045970,10.0,100.0,linear,100.0,,0.0,COMPLETE,PA
887,0.0,10.0,2026-07-23 15:48:41.235275,2026-07-23 15:48:48.861614,0 days 00:00:07.626339,10.0,10.0,geometric,10.0,,7.567,COMPLETE,PA
888,0.6,1.7,2026-07-23 15:48:41.249264,2026-07-23 15:48:48.778379,0 days 00:00:07.529115,1000.0,0.0001,linear,0.001,221.0,7.474,COMPLETE,PA
889,0.0,10.0,2026-07-23 15:48:41.263229,2026-07-23 15:48:41.298404,0 days 00:00:00.035175,1.0,1000.0,linear,10.0,,0.0,COMPLETE,PA
890,0.0,10.0,2026-07-23 15:48:41.305377,2026-07-23 15:48:41.335973,0 days 00:00:00.030596,10.0,10000.0,linear,0.01,,0.0,COMPLETE,PA
891,0.0,10.0,2026-07-23 15:48:41.349692,2026-07-23 15:48:48.735445,0 days 00:00:07.385753,0.001,0.001,linear,10.0,,7.346,COMPLETE,PA
892,0.0,10.0,2026-07-23 15:48:41.359506,2026-07-23 15:48:48.877278,0 days 00:00:07.517772,10000.0,10000.0,geometric,0.001,,7.473,COMPLETE,PA
893,0.0,10.0,2026-07-23 15:48:46.231254,2026-07-23 15:48:46.252691,0 days 00:00:00.021437,0.01,100.0,geometric,0.001,,0.0,COMPLETE,PA
894,0.0,10.0,2026-07-23 15:48:46.253415,2026-07-23 15:48:46.291836,0 days 00:00:00.038421,0.0001,0.01,linear,1000.0,,0.0,COMPLETE,PA
895,0.0,10.0,2026-07-23 15:48:46.297705,2026-07-23 15:48:53.943940,0 days 00:00:07.646235,100.0,10.0,geometric,10.0,,7.618,COMPLETE,PA
896,0.2,1.7230769230769232,2026-07-23 15:48:47.601637,2026-07-23 15:48:55.097644,0 days 00:00:07.496007,1000.0,10.0,geometric,0.0001,224.0,7.47,COMPLETE,PA
897,0.0,10.0,2026-07-23 15:48:47.621306,2026-07-23 15:48:47.654790,0 days 00:00:00.033484,0.001,10000.0,linear,0.1,,0.0,COMPLETE,PA
898,0.0,10.0,2026-07-23 15:48:47.660334,2026-07-23 15:48:54.969929,0 days 00:00:07.309595,10000.0,10000.0,geometric,0.1,,7.274,COMPLETE,PA
899,0.0,10.0,2026-07-23 15:48:47.770377,2026-07-23 15:48:47.810432,0 days 00:00:00.040055,0.1,10000.0,geometric,0.1,,0.0,COMPLETE,PA
900,0.0,10.0,2026-07-23 15:48:47.810616,2026-07-23 15:48:55.151222,0 days 00:00:07.340606,10000.0,1000.0,geometric,0.0001,,7.304,COMPLETE,PA
901,0.0,10.0,2026-07-23 15:48:47.935823,2026-07-23 15:48:55.507440,0 days 00:00:07.571617,1.0,1.0,linear,0.1,,7.544,COMPLETE,PA
902,0.6,1.676923076923077,2026-07-23 15:48:48.161422,2026-07-23 15:48:55.720386,0 days 00:00:07.558964,1000.0,0.001,linear,100.0,218.0,7.531,COMPLETE,PA
903,0.0,10.0,2026-07-23 15:48:48.736970,2026-07-23 15:48:48.756070,0 days 00:00:00.019100,0.1,10000.0,linear,10.0,,0.0,COMPLETE,PA
904,0.0,10.0,2026-07-23 15:48:48.760757,2026-07-23 15:48:48.827319,0 days 00:00:00.066562,0.0001,100.0,geometric,1.0,,0.0,COMPLETE,PA
905,0.0,10.0,2026-07-23 15:48:48.805797,2026-07-23 15:48:48.841197,0 days 00:00:00.035400,10.0,1000.0,linear,0.001,,0.0,COMPLETE,PA
906,0.0,10.0,2026-07-23 15:48:48.861684,2026-07-23 15:48:48.946926,0 days 00:00:00.085242,0.01,10.0,linear,10.0,,0.0,COMPLETE,PA
907,0.0,10.0,2026-07-23 15:48:48.877336,2026-07-23 15:48:48.922524,0 days 00:00:00.045188,1.0,10.0,linear,0.0001,,0.0,COMPLETE,PA
908,0.0,10.0,2026-07-23 15:48:48.922796,2026-07-23 15:48:49.030632,0 days 00:00:00.107836,0.001,100.0,geometric,0.01,,0.0,COMPLETE,PA
909,0.2,1.7153846153846153,2026-07-23 15:48:48.929739,2026-07-23 15:48:56.423914,0 days 00:00:07.494175,1000.0,0.1,geometric,1000.0,223.0,7.44,COMPLETE,PA
910,0.0,10.0,2026-07-23 15:48:48.935997,2026-07-23 15:48:49.074678,0 days 00:00:00.138681,0.001,10000.0,geometric,10.0,,0.0,COMPLETE,PA
911,0.0,10.0,2026-07-23 15:48:48.976114,2026-07-23 15:48:56.675333,0 days 00:00:07.699219,100.0,0.0001,geometric,0.01,,7.578,COMPLETE,PA
912,0.0,10.0,2026-07-23 15:48:49.043650,2026-07-23 15:48:56.546559,0 days 00:00:07.502909,1.0,1.0,geometric,0.001,,7.475,COMPLETE,PA
913,0.0,10.0,2026-07-23 15:48:49.088724,2026-07-23 15:48:56.476937,0 days 00:00:07.388213,100.0,0.1,linear,1000.0,,7.343,COMPLETE,PA
914,0.0,10.0,2026-07-23 15:48:53.944141,2026-07-23 15:48:53.966205,0 days 00:00:00.022064,0.01,10.0,linear,1.0,,0.0,COMPLETE,PA
915,0.0,10.0,2026-07-23 15:48:53.966358,2026-07-23 15:49:01.406599,0 days 00:00:07.440241,1000.0,1000.0,geometric,10000.0,,7.411,COMPLETE,PA
916,0.0,10.0,2026-07-23 15:48:54.976423,2026-07-23 15:48:55.013827,0 days 00:00:00.037404,1.0,10000.0,geometric,0.1,,0.0,COMPLETE,PA
917,0.0,10.0,2026-07-23 15:48:55.014029,2026-07-23 15:49:02.480015,0 days 00:00:07.465986,0.1,0.01,linear,10000.0,,7.433,COMPLETE,PA
918,0.0,10.0,2026-07-23 15:48:55.111090,2026-07-23 15:49:02.609649,0 days 00:00:07.498559,1.0,0.0001,geometric,0.001,,7.47,COMPLETE,PA
919,0.0,10.0,2026-07-23 15:48:55.155083,2026-07-23 15:49:02.653299,0 days 00:00:07.498216,10000.0,10.0,linear,0.1,,7.445,COMPLETE,PA
920,0.0,10.0,2026-07-23 15:48:55.514595,2026-07-23 15:48:55.537365,0 days 00:00:00.022770,10.0,100.0,geometric,0.01,,0.0,COMPLETE,PA
921,0.0,10.0,2026-07-23 15:48:55.545165,2026-07-23 15:49:02.958839,0 days 00:00:07.413674,1.0,1.0,linear,10000.0,,7.391,COMPLETE,PA
922,0.0,10.0,2026-07-23 15:48:55.724475,2026-07-23 15:48:55.756145,0 days 00:00:00.031670,1.0,10.0,linear,1000.0,,0.0,COMPLETE,PA
923,0.0,10.0,2026-07-23 15:48:55.766020,2026-07-23 15:49:03.290061,0 days 00:00:07.524041,0.1,0.01,geometric,0.001,,7.494,COMPLETE,PA
924,0.0,10.0,2026-07-23 15:48:56.424163,2026-07-23 15:48:56.448076,0 days 00:00:00.023913,0.0001,1000.0,linear,10000.0,,0.0,COMPLETE,PA
925,0.0,10.0,2026-07-23 15:48:56.462046,2026-07-23 15:49:04.097588,0 days 00:00:07.635542,100.0,100.0,geometric,0.0001,,7.582,COMPLETE,PA
926,0.6,1.7230769230769232,2026-07-23 15:48:56.481692,2026-07-23 15:49:04.001483,0 days 00:00:07.519791,10000.0,0.001,geometric,0.001,224.0,7.49,COMPLETE,PA
927,0.0,10.0,2026-07-23 15:48:56.547421,2026-07-23 15:48:56.572927,0 days 00:00:00.025506,0.001,1.0,linear,1000.0,,0.0,COMPLETE,PA
928,0.0,10.0,2026-07-23 15:48:56.578614,2026-07-23 15:48:56.605746,0 days 00:00:00.027132,0.001,1.0,geometric,0.001,,0.0,COMPLETE,PA
929,0.0,10.0,2026-07-23 15:48:56.605901,2026-07-23 15:48:56.638355,0 days 00:00:00.032454,0.1,100.0,geometric,1.0,,0.0,COMPLETE,PA
930,0.0,10.0,2026-07-23 15:48:56.638527,2026-07-23 15:49:04.107821,0 days 00:00:07.469294,10000.0,10.0,linear,10000.0,,7.418,COMPLETE,PA
931,0.0,10.0,2026-07-23 15:48:56.685588,2026-07-23 15:49:04.184927,0 days 00:00:07.499339,10.0,1.0,linear,0.0001,,7.442,COMPLETE,PA
932,0.0,10.0,2026-07-23 15:49:01.407076,2026-07-23 15:49:09.019552,0 days 00:00:07.612476,100.0,0.01,linear,0.001,,7.584,COMPLETE,PA
933,0.0,10.0,2026-07-23 15:49:02.495885,2026-07-23 15:49:09.950221,0 days 00:00:07.454336,0.1,0.1,linear,100.0,,7.421,COMPLETE,PA
934,0.0,10.0,2026-07-23 15:49:02.630505,2026-07-23 15:49:10.122288,0 days 00:00:07.491783,10.0,0.1,linear,1.0,,7.446,COMPLETE,PA
935,0.0,10.0,2026-07-23 15:49:02.669275,2026-07-23 15:49:10.332884,0 days 00:00:07.663609,10.0,0.001,linear,0.01,,7.626,COMPLETE,PA
936,0.0,10.0,2026-07-23 15:49:02.968215,2026-07-23 15:49:10.623973,0 days 00:00:07.655758,100.0,10.0,linear,0.0001,,7.622,COMPLETE,PA
937,0.0,10.0,2026-07-23 15:49:03.291043,2026-07-23 15:49:03.320722,0 days 00:00:00.029679,10.0,100.0,linear,0.1,,0.0,COMPLETE,PA
938,0.0,10.0,2026-07-23 15:49:03.324574,2026-07-23 15:49:10.846876,0 days 00:00:07.522302,10000.0,0.001,linear,10.0,,7.493,COMPLETE,PA
939,0.0,10.0,2026-07-23 15:49:04.003639,2026-07-23 15:49:11.654344,0 days 00:00:07.650705,100.0,10.0,geometric,0.0001,,7.559,COMPLETE,PA
940,0.0,10.0,2026-07-23 15:49:04.107906,2026-07-23 15:49:11.714960,0 days 00:00:07.607054,10000.0,0.01,linear,1000.0,,7.552,COMPLETE,PA
941,0.0,10.0,2026-07-23 15:49:04.128154,2026-07-23 15:49:04.195094,0 days 00:00:00.066940,1.0,1000.0,geometric,10000.0,,0.0,COMPLETE,PA
942,0.4,1.5692307692307692,2026-07-23 15:49:04.185127,2026-07-23 15:49:11.758510,0 days 00:00:07.573383,1000.0,1.0,geometric,0.01,204.0,7.534,COMPLETE,PA
943,0.0,10.0,2026-07-23 15:49:04.215761,2026-07-23 15:49:04.240970,0 days 00:00:00.025209,0.1,100.0,linear,10000.0,,0.0,COMPLETE,PA
944,0.0,10.0,2026-07-23 15:49:04.241174,2026-07-23 15:49:04.265338,0 days 00:00:00.024164,1000.0,10000.0,linear,0.01,,0.0,COMPLETE,PA
945,0.2,1.6692307692307693,2026-07-23 15:49:04.265490,2026-07-23 15:49:11.796984,0 days 00:00:07.531494,1000.0,0.0001,geometric,10000.0,217.0,7.492,COMPLETE,PA
946,0.0,10.0,2026-07-23 15:49:09.031601,2026-07-23 15:49:09.057692,0 days 00:00:00.026091,0.01,100.0,geometric,1.0,,0.0,COMPLETE,PA
947,0.0,10.0,2026-07-23 15:49:09.062763,2026-07-23 15:49:09.091919,0 days 00:00:00.029156,0.0001,0.1,linear,1.0,,0.0,COMPLETE,PA
948,0.4,1.6692307692307693,2026-07-23 15:49:09.095465,2026-07-23 15:49:16.835539,0 days 00:00:07.740074,1000.0,1.0,linear,1000.0,217.0,7.705,COMPLETE,PA
949,0.0,10.0,2026-07-23 15:49:09.950775,2026-07-23 15:49:09.981308,0 days 00:00:00.030533,0.1,10.0,linear,10000.0,,0.0,COMPLETE,PA
950,0.0,10.0,2026-07-23 15:49:09.981498,2026-07-23 15:49:10.010610,0 days 00:00:00.029112,0.0001,10.0,geometric,10000.0,,0.0,COMPLETE,PA
951,0.0,10.0,2026-07-23 15:49:10.013054,2026-07-23 15:49:17.894957,0 days 00:00:07.881903,100.0,0.1,linear,1.0,,7.839,COMPLETE,PA
952,0.0,10.0,2026-07-23 15:49:10.125521,2026-07-23 15:49:17.780032,0 days 00:00:07.654511,10.0,0.001,linear,0.001,,7.621,COMPLETE,PA
953,0.0,10.0,2026-07-23 15:49:10.341097,2026-07-23 15:49:10.413132,0 days 00:00:00.072035,1.0,10000.0,linear,0.001,,0.0,COMPLETE,PA
954,0.0,10.0,2026-07-23 15:49:10.414146,2026-07-23 15:49:17.819624,0 days 00:00:07.405478,0.0001,0.0001,geometric,10.0,,7.37,COMPLETE,PA
955,0.0,10.0,2026-07-23 15:49:10.632704,2026-07-23 15:49:10.661840,0 days 00:00:00.029136,0.001,10.0,linear,10000.0,,0.0,COMPLETE,PA
956,0.0,10.0,2026-07-23 15:49:10.662552,2026-07-23 15:49:10.694575,0 days 00:00:00.032023,0.0001,0.01,geometric,0.001,,0.0,COMPLETE,PA
957,0.0,10.0,2026-07-23 15:49:10.706263,2026-07-23 15:49:10.736999,0 days 00:00:00.030736,0.01,1000.0,linear,0.01,,0.0,COMPLETE,PA
958,0.6,1.676923076923077,2026-07-23 15:49:10.737183,2026-07-23 15:49:18.169616,0 days 00:00:07.432433,1000.0,0.01,linear,0.0001,218.0,7.402,COMPLETE,PA
959,0.0,10.0,2026-07-23 15:49:10.847054,2026-07-23 15:49:18.308250,0 days 00:00:07.461196,1.0,1.0,geometric,1.0,,7.433,COMPLETE,PA
