number,values_0,values_1,datetime_start,datetime_complete,duration,params_beta_max,params_beta_min,params_beta_schedule_type,params_gamma,user_attrs_best_cost,user_attrs_time_s,state,solver
1436,0.6,1.676923076923077,2026-07-23 15:52:31.736360,2026-07-23 15:52:39.414508,0 days 00:00:07.678148,1000.0,0.01,linear,0.01,218.0,7.619,COMPLETE,PA
1437,0.0,10.0,2026-07-23 15:52:31.775426,2026-07-23 15:52:31.817718,0 days 00:00:00.042292,0.0001,1000.0,geometric,0.0001,,0.0,COMPLETE,PA
1438,0.0,10.0,2026-07-23 15:52:31.817907,2026-07-23 15:52:39.553367,0 days 00:00:07.735460,10.0,0.01,geometric,0.001,,7.686,COMPLETE,PA
1439,0.0,10.0,2026-07-23 15:52:32.129012,2026-07-23 15:52:39.714893,0 days 00:00:07.585881,10000.0,1.0,linear,0.0001,,7.54,COMPLETE,PA
1440,0.0,10.0,2026-07-23 15:52:32.439540,2026-07-23 15:52:40.193636,0 days 00:00:07.754096,10.0,0.01,linear,0.0001,,7.681,COMPLETE,PA
1441,0.0,10.0,2026-07-23 15:52:36.543193,2026-07-23 15:52:36.582354,0 days 00:00:00.039161,0.001,100.0,geometric,10.0,,0.0,COMPLETE,PA
1442,0.0,10.0,2026-07-23 15:52:36.584901,2026-07-23 15:52:44.162380,0 days 00:00:07.577479,10000.0,1.0,linear,1.0,,7.528,COMPLETE,PA
1443,0.0,10.0,2026-07-23 15:52:37.735491,2026-07-23 15:52:37.808664,0 days 00:00:00.073173,0.01,0.1,geometric,0.0001,,0.0,COMPLETE,PA
1444,0.0,10.0,2026-07-23 15:52:37.809762,2026-07-23 15:52:45.279538,0 days 00:00:07.469776,10000.0,10.0,linear,0.01,,7.412,COMPLETE,PA
1445,0.0,10.0,2026-07-23 15:52:38.147491,2026-07-23 15:52:38.190797,0 days 00:00:00.043306,0.0001,0.1,linear,10000.0,,0.0,COMPLETE,PA
1446,0.0,10.0,2026-07-23 15:52:38.197668,2026-07-23 15:52:45.604586,0 days 00:00:07.406918,1.0,0.001,geometric,10.0,,7.362,COMPLETE,PA
1447,0.0,10.0,2026-07-23 15:52:38.324182,2026-07-23 15:52:45.815535,0 days 00:00:07.491353,10.0,0.1,geometric,100.0,,7.444,COMPLETE,PA
1448,0.0,10.0,2026-07-23 15:52:39.145025,2026-07-23 15:52:46.361622,0 days 00:00:07.216597,0.001,0.001,geometric,1000.0,,7.169,COMPLETE,PA
1449,0.0,10.0,2026-07-23 15:52:39.361925,2026-07-23 15:52:46.691356,0 days 00:00:07.329431,100.0,10.0,geometric,10000.0,,7.266,COMPLETE,PA
1450,0.0,10.0,2026-07-23 15:52:39.422283,2026-07-23 15:52:46.659290,0 days 00:00:07.237007,0.1,0.001,geometric,0.0001,,7.179,COMPLETE,PA
1451,0.0,10.0,2026-07-23 15:52:39.557171,2026-07-23 15:52:46.698017,0 days 00:00:07.140846,10000.0,10.0,linear,0.001,,7.08,COMPLETE,PA
1452,0.0,10.0,2026-07-23 15:52:39.720674,2026-07-23 15:52:39.768466,0 days 00:00:00.047792,0.001,100.0,geometric,10000.0,,0.0,COMPLETE,PA
1453,0.0,10.0,2026-07-23 15:52:39.768770,2026-07-23 15:52:39.815357,0 days 00:00:00.046587,0.001,100.0,geometric,0.1,,0.0,COMPLETE,PA
1454,0.0,10.0,2026-07-23 15:52:39.817755,2026-07-23 15:52:39.866912,0 days 00:00:00.049157,0.0001,0.1,geometric,0.0001,,0.0,COMPLETE,PA
1455,0.0,10.0,2026-07-23 15:52:39.870431,2026-07-23 15:52:46.964771,0 days 00:00:07.094340,1.0,0.1,geometric,0.001,,7.044,COMPLETE,PA
1456,0.2,1.676923076923077,2026-07-23 15:52:40.194868,2026-07-23 15:52:47.312475,0 days 00:00:07.117607,1000.0,0.1,linear,0.001,218.0,7.08,COMPLETE,PA
1457,0.0,10.0,2026-07-23 15:52:44.163906,2026-07-23 15:52:44.208116,0 days 00:00:00.044210,0.01,0.1,linear,10.0,,0.0,COMPLETE,PA
