number,values_0,values_1,datetime_start,datetime_complete,duration,params_beta_max,params_beta_min,params_beta_schedule_type,params_gamma,user_attrs_best_cost,user_attrs_time_s,state,solver
960,0.0,10.0,2026-07-23 15:49:11.662242,2026-07-23 15:49:19.199547,0 days 00:00:07.537305,10000.0,0.001,linear,1000.0,,7.501,COMPLETE,PA
961,0.2,1.6692307692307693,2026-07-23 15:49:11.717056,2026-07-23 15:49:19.094181,0 days 00:00:07.377125,1000.0,0.0001,geometric,0.1,217.0,7.341,COMPLETE,PA
962,0.0,10.0,2026-07-23 15:49:11.761185,2026-07-23 15:49:19.049408,0 days 00:00:07.288223,1000.0,1000.0,linear,0.001,,7.248,COMPLETE,PA
963,0.0,10.0,2026-07-23 15:49:11.797313,2026-07-23 15:49:11.825241,0 days 00:00:00.027928,0.0001,0.001,geometric,0.0001,,0.0,COMPLETE,PA
964,0.0,10.0,2026-07-23 15:49:11.829295,2026-07-23 15:49:19.426306,0 days 00:00:07.597011,100.0,0.01,linear,1.0,,7.561,COMPLETE,PA
965,0.6,1.676923076923077,2026-07-23 15:49:16.843198,2026-07-23 15:49:24.202808,0 days 00:00:07.359610,1000.0,0.001,linear,0.0001,218.0,7.322,COMPLETE,PA
966,0.0,10.0,2026-07-23 15:49:17.782084,2026-07-23 15:49:25.498598,0 days 00:00:07.716514,100.0,100.0,geometric,1000.0,,7.674,COMPLETE,PA
967,0.0,10.0,2026-07-23 15:49:17.826368,2026-07-23 15:49:17.917266,0 days 00:00:00.090898,0.001,0.1,geometric,0.1,,0.0,COMPLETE,PA
968,0.0,10.0,2026-07-23 15:49:17.917960,2026-07-23 15:49:25.384103,0 days 00:00:07.466143,10000.0,100.0,linear,0.0001,,7.427,COMPLETE,PA
969,0.0,10.0,2026-07-23 15:49:17.927828,2026-07-23 15:49:25.403150,0 days 00:00:07.475322,10.0,0.1,geometric,10000.0,,7.437,COMPLETE,PA
970,0.2,1.7538461538461538,2026-07-23 15:49:18.169877,2026-07-23 15:49:25.621688,0 days 00:00:07.451811,1000.0,100.0,linear,10.0,228.0,7.426,COMPLETE,PA
971,0.0,10.0,2026-07-23 15:49:18.313629,2026-07-23 15:49:18.337685,0 days 00:00:00.024056,100.0,10000.0,linear,10.0,,0.0,COMPLETE,PA
972,0.4,1.5538461538461539,2026-07-23 15:49:18.348119,2026-07-23 15:49:25.846165,0 days 00:00:07.498046,10000.0,10.0,geometric,10.0,202.0,7.468,COMPLETE,PA
973,0.0,10.0,2026-07-23 15:49:19.053564,2026-07-23 15:49:26.568226,0 days 00:00:07.514662,100.0,0.1,linear,0.001,,7.48,COMPLETE,PA
974,0.4,1.5692307692307692,2026-07-23 15:49:19.104285,2026-07-23 15:49:26.678617,0 days 00:00:07.574332,1000.0,1.0,geometric,10000.0,204.0,7.546,COMPLETE,PA
975,0.0,10.0,2026-07-23 15:49:19.203215,2026-07-23 15:49:19.231928,0 days 00:00:00.028713,0.01,0.1,geometric,0.01,,0.0,COMPLETE,PA
976,0.0,10.0,2026-07-23 15:49:19.237556,2026-07-23 15:49:26.741799,0 days 00:00:07.504243,100.0,1.0,geometric,10.0,,7.459,COMPLETE,PA
977,0.0,10.0,2026-07-23 15:49:19.432757,2026-07-23 15:49:19.489729,0 days 00:00:00.056972,0.1,1.0,geometric,10.0,,0.0,COMPLETE,PA
978,0.0,10.0,2026-07-23 15:49:19.494298,2026-07-23 15:49:26.789927,0 days 00:00:07.295629,10000.0,0.0001,linear,10000.0,,7.258,COMPLETE,PA
979,0.0,10.0,2026-07-23 15:49:24.205042,2026-07-23 15:49:31.649985,0 days 00:00:07.444943,1000.0,1000.0,linear,0.1,,7.411,COMPLETE,PA
980,0.0,10.0,2026-07-23 15:49:25.403207,2026-07-23 15:49:25.444128,0 days 00:00:00.040921,0.001,10.0,geometric,1.0,,0.0,COMPLETE,PA
981,0.0,10.0,2026-07-23 15:49:25.432102,2026-07-23 15:49:32.962055,0 days 00:00:07.529953,0.0001,0.0001,linear,1000.0,,7.501,COMPLETE,PA
982,0.0,10.0,2026-07-23 15:49:25.451372,2026-07-23 15:49:25.480932,0 days 00:00:00.029560,0.0001,0.1,linear,100.0,,0.0,COMPLETE,PA
983,0.0,10.0,2026-07-23 15:49:25.498660,2026-07-23 15:49:25.550597,0 days 00:00:00.051937,0.001,10000.0,geometric,0.1,,0.0,COMPLETE,PA
984,0.0,10.0,2026-07-23 15:49:25.513054,2026-07-23 15:49:33.114299,0 days 00:00:07.601245,0.1,0.0001,geometric,1000.0,,7.566,COMPLETE,PA
985,0.0,10.0,2026-07-23 15:49:25.559823,2026-07-23 15:49:25.589590,0 days 00:00:00.029767,1.0,1000.0,geometric,1.0,,0.0,COMPLETE,PA
986,0.0,10.0,2026-07-23 15:49:25.591292,2026-07-23 15:49:33.000369,0 days 00:00:07.409077,10.0,10.0,geometric,1.0,,7.361,COMPLETE,PA
987,0.0,10.0,2026-07-23 15:49:25.634558,2026-07-23 15:49:33.105769,0 days 00:00:07.471211,0.1,0.0001,linear,1000.0,,7.422,COMPLETE,PA
988,0.0,10.0,2026-07-23 15:49:25.847981,2026-07-23 15:49:33.301948,0 days 00:00:07.453967,10.0,0.001,linear,1.0,,7.422,COMPLETE,PA
989,0.0,10.0,2026-07-23 15:49:26.573413,2026-07-23 15:49:26.601292,0 days 00:00:00.027879,1.0,10.0,linear,10.0,,0.0,COMPLETE,PA
990,0.0,10.0,2026-07-23 15:49:26.606793,2026-07-23 15:49:26.634103,0 days 00:00:00.027310,1.0,10000.0,linear,10000.0,,0.0,COMPLETE,PA
991,0.4,1.623076923076923,2026-07-23 15:49:26.637202,2026-07-23 15:49:34.184779,0 days 00:00:07.547577,10000.0,0.1,geometric,10.0,211.0,7.507,COMPLETE,PA
992,0.0,10.0,2026-07-23 15:49:26.684684,2026-07-23 15:49:26.712169,0 days 00:00:00.027485,0.01,0.1,geometric,1.0,,0.0,COMPLETE,PA
993,0.0,10.0,2026-07-23 15:49:26.724757,2026-07-23 15:49:34.206549,0 days 00:00:07.481792,1.0,0.001,linear,0.01,,7.445,COMPLETE,PA
994,0.0,10.0,2026-07-23 15:49:26.749483,2026-07-23 15:49:34.191311,0 days 00:00:07.441828,10.0,0.01,geometric,1.0,,7.41,COMPLETE,PA
995,0.0,10.0,2026-07-23 15:49:26.790128,2026-07-23 15:49:26.822078,0 days 00:00:00.031950,10.0,10000.0,linear,100.0,,0.0,COMPLETE,PA
996,0.0,10.0,2026-07-23 15:49:26.824978,2026-07-23 15:49:26.853167,0 days 00:00:00.028189,0.01,0.1,geometric,10.0,,0.0,COMPLETE,PA
997,0.0,10.0,2026-07-23 15:49:26.853329,2026-07-23 15:49:26.889666,0 days 00:00:00.036337,0.0001,1000.0,geometric,1.0,,0.0,COMPLETE,PA
998,0.0,10.0,2026-07-23 15:49:26.889847,2026-07-23 15:49:26.927665,0 days 00:00:00.037818,0.01,100.0,geometric,100.0,,0.0,COMPLETE,PA
999,0.0,10.0,2026-07-23 15:49:26.927844,2026-07-23 15:49:26.954888,0 days 00:00:00.027044,0.0001,0.1,geometric,0.001,,0.0,COMPLETE,PA
1000,0.2,1.9230769230769231,2026-07-23 15:49:26.955137,2026-07-23 15:49:34.416900,0 days 00:00:07.461763,10000.0,0.0001,geometric,0.1,250.0,7.409,COMPLETE,PA
1001,0.0,10.0,2026-07-23 15:49:31.652674,2026-07-23 15:49:39.091149,0 days 00:00:07.438475,0.001,0.0001,geometric,0.0001,,7.395,COMPLETE,PA
1002,0.0,10.0,2026-07-23 15:49:32.964746,2026-07-23 15:49:40.473528,0 days 00:00:07.508782,100.0,100.0,linear,0.1,,7.471,COMPLETE,PA
1003,0.4,1.5538461538461539,2026-07-23 15:49:33.004141,2026-07-23 15:49:40.559312,0 days 00:00:07.555171,10000.0,10.0,geometric,1.0,202.0,7.516,COMPLETE,PA
1004,0.6,1.676923076923077,2026-07-23 15:49:33.124578,2026-07-23 15:49:40.634974,0 days 00:00:07.510396,1000.0,0.01,linear,10.0,218.0,7.453,COMPLETE,PA
1005,0.4,1.623076923076923,2026-07-23 15:49:33.139211,2026-07-23 15:49:40.640731,0 days 00:00:07.501520,10000.0,0.1,geometric,0.01,211.0,7.455,COMPLETE,PA
1006,0.0,10.0,2026-07-23 15:49:33.304198,2026-07-23 15:49:33.337788,0 days 00:00:00.033590,0.001,10000.0,geometric,1.0,,0.0,COMPLETE,PA
1007,0.0,10.0,2026-07-23 15:49:33.342896,2026-07-23 15:49:33.414100,0 days 00:00:00.071204,0.01,0.1,linear,0.1,,0.0,COMPLETE,PA
1008,0.0,10.0,2026-07-23 15:49:33.420409,2026-07-23 15:49:40.917239,0 days 00:00:07.496830,10.0,10.0,geometric,10000.0,,7.467,COMPLETE,PA
1009,0.0,10.0,2026-07-23 15:49:34.206616,2026-07-23 15:49:41.674885,0 days 00:00:07.468269,100.0,1.0,geometric,100.0,,7.43,COMPLETE,PA
1010,0.0,10.0,2026-07-23 15:49:34.211575,2026-07-23 15:49:34.278634,0 days 00:00:00.067059,1.0,10000.0,geometric,0.001,,0.0,COMPLETE,PA
1011,0.0,10.0,2026-07-23 15:49:34.231110,2026-07-23 15:49:34.279835,0 days 00:00:00.048725,0.001,0.01,geometric,10000.0,,0.0,COMPLETE,PA
1012,0.0,10.0,2026-07-23 15:49:34.279965,2026-07-23 15:49:41.824648,0 days 00:00:07.544683,1.0,0.001,linear,1.0,,7.461,COMPLETE,PA
1013,0.0,10.0,2026-07-23 15:49:34.288654,2026-07-23 15:49:34.336226,0 days 00:00:00.047572,0.0001,1.0,linear,100.0,,0.0,COMPLETE,PA
1014,0.0,10.0,2026-07-23 15:49:34.340968,2026-07-23 15:49:34.375443,0 days 00:00:00.034475,0.1,100.0,geometric,1000.0,,0.0,COMPLETE,PA
1015,0.0,10.0,2026-07-23 15:49:34.393446,2026-07-23 15:49:34.453937,0 days 00:00:00.060491,0.0001,100.0,linear,0.001,,0.0,COMPLETE,PA
1016,0.0,10.0,2026-07-23 15:49:34.442289,2026-07-23 15:49:34.484657,0 days 00:00:00.042368,0.0001,100.0,linear,0.0001,,0.0,COMPLETE,PA
1017,0.0,10.0,2026-07-23 15:49:34.474679,2026-07-23 15:49:34.501389,0 days 00:00:00.026710,1.0,100.0,linear,1000.0,,0.0,COMPLETE,PA
1018,0.0,10.0,2026-07-23 15:49:34.501441,2026-07-23 15:49:34.559363,0 days 00:00:00.057922,0.0001,10.0,geometric,100.0,,0.0,COMPLETE,PA
1019,0.0,10.0,2026-07-23 15:49:34.504984,2026-07-23 15:49:42.049983,0 days 00:00:07.544999,0.0001,0.0001,geometric,1000.0,,7.505,COMPLETE,PA
1020,0.0,10.0,2026-07-23 15:49:34.567685,2026-07-23 15:49:34.604215,0 days 00:00:00.036530,0.1,100.0,geometric,0.01,,0.0,COMPLETE,PA
1021,0.0,10.0,2026-07-23 15:49:34.608769,2026-07-23 15:49:34.662225,0 days 00:00:00.053456,0.0001,100.0,linear,1.0,,0.0,COMPLETE,PA
1022,0.2,1.6692307692307693,2026-07-23 15:49:34.664034,2026-07-23 15:49:42.325238,0 days 00:00:07.661204,1000.0,0.0001,geometric,10.0,217.0,7.616,COMPLETE,PA
1023,0.0,10.0,2026-07-23 15:49:39.105406,2026-07-23 15:49:46.766680,0 days 00:00:07.661274,0.0001,0.0001,linear,100.0,,7.62,COMPLETE,PA
1024,0.2,1.7153846153846153,2026-07-23 15:49:40.478549,2026-07-23 15:49:48.125411,0 days 00:00:07.646862,1000.0,0.1,geometric,0.001,223.0,7.61,COMPLETE,PA
1025,0.0,10.0,2026-07-23 15:49:40.564335,2026-07-23 15:49:40.594108,0 days 00:00:00.029773,0.001,10000.0,geometric,100.0,,0.0,COMPLETE,PA
1026,0.0,10.0,2026-07-23 15:49:40.600622,2026-07-23 15:49:48.591539,0 days 00:00:07.990917,100.0,0.01,linear,1000.0,,7.899,COMPLETE,PA
1027,0.0,10.0,2026-07-23 15:49:40.644105,2026-07-23 15:49:40.708494,0 days 00:00:00.064389,0.01,10.0,geometric,1000.0,,0.0,COMPLETE,PA
1028,0.0,10.0,2026-07-23 15:49:40.646285,2026-07-23 15:49:48.358837,0 days 00:00:07.712552,10.0,0.0001,geometric,10.0,,7.664,COMPLETE,PA
1029,0.2,1.6692307692307693,2026-07-23 15:49:40.716028,2026-07-23 15:49:48.302324,0 days 00:00:07.586296,1000.0,0.0001,geometric,1000.0,217.0,7.549,COMPLETE,PA
1030,0.0,10.0,2026-07-23 15:49:40.920244,2026-07-23 15:49:48.646829,0 days 00:00:07.726585,10000.0,1.0,linear,10000.0,,7.684,COMPLETE,PA
1031,0.0,10.0,2026-07-23 15:49:41.678653,2026-07-23 15:49:41.708784,0 days 00:00:00.030131,0.01,10000.0,linear,0.01,,0.0,COMPLETE,PA
1032,0.0,10.0,2026-07-23 15:49:41.711650,2026-07-23 15:49:41.743830,0 days 00:00:00.032180,0.0001,1.0,linear,0.0001,,0.0,COMPLETE,PA
1033,0.0,10.0,2026-07-23 15:49:41.745615,2026-07-23 15:49:49.670279,0 days 00:00:07.924664,10.0,10.0,geometric,100.0,,7.847,COMPLETE,PA
1034,0.4,1.6692307692307693,2026-07-23 15:49:41.831385,2026-07-23 15:49:49.642382,0 days 00:00:07.810997,1000.0,1.0,linear,0.001,217.0,7.767,COMPLETE,PA
1035,0.0,10.0,2026-07-23 15:49:42.058891,2026-07-23 15:49:49.818094,0 days 00:00:07.759203,0.0001,0.0001,geometric,0.1,,7.665,COMPLETE,PA
1036,0.0,10.0,2026-07-23 15:49:42.328462,2026-07-23 15:49:49.913683,0 days 00:00:07.585221,10000.0,1.0,linear,10.0,,7.553,COMPLETE,PA
1037,0.0,10.0,2026-07-23 15:49:46.774234,2026-07-23 15:49:46.800080,0 days 00:00:00.025846,1.0,10000.0,linear,0.1,,0.0,COMPLETE,PA
1038,0.0,10.0,2026-07-23 15:49:46.804433,2026-07-23 15:49:54.404349,0 days 00:00:07.599916,0.01,0.001,geometric,1000.0,,7.562,COMPLETE,PA
1039,0.0,10.0,2026-07-23 15:49:48.135417,2026-07-23 15:49:55.601655,0 days 00:00:07.466238,1.0,0.0001,geometric,1000.0,,7.419,COMPLETE,PA
1040,0.0,10.0,2026-07-23 15:49:48.305339,2026-07-23 15:49:55.854369,0 days 00:00:07.549030,0.0001,0.0001,linear,0.001,,7.46,COMPLETE,PA
1041,0.0,10.0,2026-07-23 15:49:48.367189,2026-07-23 15:49:55.854915,0 days 00:00:07.487726,10000.0,0.1,linear,10.0,,7.408,COMPLETE,PA
1042,0.0,10.0,2026-07-23 15:49:48.592285,2026-07-23 15:49:56.075295,0 days 00:00:07.483010,0.001,0.001,geometric,0.001,,7.439,COMPLETE,PA
1043,0.0,10.0,2026-07-23 15:49:48.650510,2026-07-23 15:49:56.384277,0 days 00:00:07.733767,1000.0,1000.0,geometric,1.0,,7.701,COMPLETE,PA
1044,0.0,10.0,2026-07-23 15:49:49.657008,2026-07-23 15:49:57.199419,0 days 00:00:07.542411,10.0,1.0,linear,10.0,,7.505,COMPLETE,PA
1045,0.0,10.0,2026-07-23 15:49:49.681465,2026-07-23 15:49:57.195536,0 days 00:00:07.514071,10.0,10.0,geometric,0.1,,7.474,COMPLETE,PA
1046,0.6,1.6,2026-07-23 15:49:49.818633,2026-07-23 15:49:57.345021,0 days 00:00:07.526388,10000.0,100.0,geometric,0.1,208.0,7.494,COMPLETE,PA
1047,0.0,10.0,2026-07-23 15:49:49.917174,2026-07-23 15:49:57.610835,0 days 00:00:07.693661,0.01,0.01,geometric,1.0,,7.649,COMPLETE,PA
1048,0.0,10.0,2026-07-23 15:49:54.409169,2026-07-23 15:49:54.444125,0 days 00:00:00.034956,0.001,1000.0,geometric,0.01,,0.0,COMPLETE,PA
1049,0.0,10.0,2026-07-23 15:49:54.445959,2026-07-23 15:49:54.471530,0 days 00:00:00.025571,0.1,10000.0,linear,0.1,,0.0,COMPLETE,PA
1050,0.0,10.0,2026-07-23 15:49:54.471680,2026-07-23 15:49:54.500825,0 days 00:00:00.029145,100.0,10000.0,linear,1000.0,,0.0,COMPLETE,PA
1051,0.0,10.0,2026-07-23 15:49:54.501732,2026-07-23 15:49:54.529916,0 days 00:00:00.028184,0.0001,0.001,linear,0.001,,0.0,COMPLETE,PA
1052,0.2,1.9230769230769231,2026-07-23 15:49:54.537846,2026-07-23 15:50:02.076141,0 days 00:00:07.538295,10000.0,0.0001,geometric,100.0,250.0,7.498,COMPLETE,PA
1053,0.0,10.0,2026-07-23 15:49:55.606610,2026-07-23 15:49:55.632499,0 days 00:00:00.025889,1000.0,10000.0,linear,0.0001,,0.0,COMPLETE,PA
1054,0.0,10.0,2026-07-23 15:49:55.637829,2026-07-23 15:49:55.673856,0 days 00:00:00.036027,1.0,10.0,linear,1.0,,0.0,COMPLETE,PA
1055,0.0,10.0,2026-07-23 15:49:55.683976,2026-07-23 15:49:55.713196,0 days 00:00:00.029220,10.0,100.0,geometric,1.0,,0.0,COMPLETE,PA
1056,0.0,10.0,2026-07-23 15:49:55.716897,2026-07-23 15:50:03.300199,0 days 00:00:07.583302,0.1,0.01,linear,0.001,,7.544,COMPLETE,PA
1057,0.0,10.0,2026-07-23 15:49:55.855318,2026-07-23 15:50:03.409794,0 days 00:00:07.554476,0.001,0.001,geometric,10.0,,7.495,COMPLETE,PA
1058,0.0,10.0,2026-07-23 15:49:55.865853,2026-07-23 15:49:55.906614,0 days 00:00:00.040761,1.0,100.0,linear,0.01,,0.0,COMPLETE,PA
1059,0.0,10.0,2026-07-23 15:49:55.920944,2026-07-23 15:49:55.959281,0 days 00:00:00.038337,0.001,1000.0,linear,10000.0,,0.0,COMPLETE,PA
1060,0.0,10.0,2026-07-23 15:49:55.964963,2026-07-23 15:50:03.344162,0 days 00:00:07.379199,0.01,0.001,geometric,100.0,,7.344,COMPLETE,PA
1061,0.0,10.0,2026-07-23 15:49:56.076955,2026-07-23 15:49:56.107105,0 days 00:00:00.030150,0.1,10000.0,geometric,10.0,,0.0,COMPLETE,PA
1062,0.0,10.0,2026-07-23 15:49:56.107258,2026-07-23 15:50:03.808602,0 days 00:00:07.701344,1.0,0.01,geometric,10000.0,,7.669,COMPLETE,PA
1063,0.2,1.7230769230769232,2026-07-23 15:49:56.385300,2026-07-23 15:50:04.093850,0 days 00:00:07.708550,1000.0,10.0,geometric,100.0,224.0,7.669,COMPLETE,PA
1064,0.0,10.0,2026-07-23 15:49:57.200437,2026-07-23 15:50:04.762993,0 days 00:00:07.562556,10000.0,0.0001,linear,1000.0,,7.508,COMPLETE,PA
1065,0.0,10.0,2026-07-23 15:49:57.215490,2026-07-23 15:50:04.677486,0 days 00:00:07.461996,1.0,1.0,linear,0.01,,7.413,COMPLETE,PA
1066,0.0,10.0,2026-07-23 15:49:57.345226,2026-07-23 15:49:57.380431,0 days 00:00:00.035205,0.1,10.0,geometric,0.0001,,0.0,COMPLETE,PA
1067,0.0,10.0,2026-07-23 15:49:57.380619,2026-07-23 15:49:57.416027,0 days 00:00:00.035408,0.1,10000.0,geometric,0.001,,0.0,COMPLETE,PA
1068,0.0,10.0,2026-07-23 15:49:57.422670,2026-07-23 15:50:04.965928,0 days 00:00:07.543258,0.001,0.0001,geometric,10000.0,,7.507,COMPLETE,PA
1069,0.0,10.0,2026-07-23 15:49:57.615634,2026-07-23 15:50:05.108084,0 days 00:00:07.492450,1000.0,1000.0,geometric,0.01,,7.422,COMPLETE,PA
1070,0.0,10.0,2026-07-23 15:50:02.080732,2026-07-23 15:50:09.889662,0 days 00:00:07.808930,100.0,0.001,geometric,0.1,,7.772,COMPLETE,PA
1071,0.0,10.0,2026-07-23 15:50:03.301403,2026-07-23 15:50:10.834739,0 days 00:00:07.533336,100.0,1.0,geometric,0.1,,7.497,COMPLETE,PA
1072,0.4,1.7692307692307692,2026-07-23 15:50:03.349244,2026-07-23 15:50:11.167425,0 days 00:00:07.818181,10000.0,1.0,geometric,0.01,230.0,7.778,COMPLETE,PA
1073,0.0,10.0,2026-07-23 15:50:03.420669,2026-07-23 15:50:03.462928,0 days 00:00:00.042259,0.001,1000.0,geometric,10.0,,0.0,COMPLETE,PA
1074,0.0,10.0,2026-07-23 15:50:03.463448,2026-07-23 15:50:03.501103,0 days 00:00:00.037655,0.1,10000.0,geometric,0.01,,0.0,COMPLETE,PA
1075,0.2,1.9230769230769231,2026-07-23 15:50:03.507208,2026-07-23 15:50:11.043269,0 days 00:00:07.536061,10000.0,0.0001,geometric,1000.0,250.0,7.485,COMPLETE,PA
1076,0.0,10.0,2026-07-23 15:50:03.811528,2026-07-23 15:50:11.213456,0 days 00:00:07.401928,1.0,0.001,geometric,1000.0,,7.336,COMPLETE,PA
1077,0.4,1.5692307692307692,2026-07-23 15:50:04.096901,2026-07-23 15:50:11.583960,0 days 00:00:07.487059,1000.0,1.0,geometric,1.0,204.0,7.442,COMPLETE,PA
1078,0.0,10.0,2026-07-23 15:50:04.679569,2026-07-23 15:50:04.713074,0 days 00:00:00.033505,0.001,10.0,linear,0.001,,0.0,COMPLETE,PA
1079,0.0,10.0,2026-07-23 15:50:04.717806,2026-07-23 15:50:04.755592,0 days 00:00:00.037786,0.001,1.0,linear,1.0,,0.0,COMPLETE,PA
1080,0.0,10.0,2026-07-23 15:50:04.763174,2026-07-23 15:50:12.311255,0 days 00:00:07.548081,1.0,0.1,geometric,1.0,,7.488,COMPLETE,PA
1081,0.0,10.0,2026-07-23 15:50:04.770365,2026-07-23 15:50:04.811958,0 days 00:00:00.041593,0.01,0.1,geometric,10000.0,,0.0,COMPLETE,PA
1082,0.0,10.0,2026-07-23 15:50:04.812949,2026-07-23 15:50:12.418580,0 days 00:00:07.605631,10000.0,1.0,linear,0.1,,7.575,COMPLETE,PA
1083,0.0,10.0,2026-07-23 15:50:04.967594,2026-07-23 15:50:05.043510,0 days 00:00:00.075916,10.0,10000.0,linear,0.1,,0.0,COMPLETE,PA
1084,0.0,10.0,2026-07-23 15:50:05.050140,2026-07-23 15:50:05.112852,0 days 00:00:00.062712,0.01,10000.0,geometric,0.0001,,0.0,COMPLETE,PA
1085,0.0,10.0,2026-07-23 15:50:05.112902,2026-07-23 15:50:05.178353,0 days 00:00:00.065451,0.0001,10000.0,geometric,0.0001,,0.0,COMPLETE,PA
1086,0.0,10.0,2026-07-23 15:50:05.124176,2026-07-23 15:50:12.631437,0 days 00:00:07.507261,1000.0,1000.0,geometric,0.1,,7.46,COMPLETE,PA
1087,0.2,1.6,2026-07-23 15:50:05.182695,2026-07-23 15:50:12.868010,0 days 00:00:07.685315,1000.0,0.01,geometric,1.0,208.0,7.642,COMPLETE,PA
1088,0.0,10.0,2026-07-23 15:50:09.892059,2026-07-23 15:50:17.497421,0 days 00:00:07.605362,100.0,0.1,linear,0.0001,,7.556,COMPLETE,PA
1089,0.0,10.0,2026-07-23 15:50:10.844937,2026-07-23 15:50:18.364050,0 days 00:00:07.519113,10000.0,0.1,linear,100.0,,7.486,COMPLETE,PA
1090,0.0,10.0,2026-07-23 15:50:11.050799,2026-07-23 15:50:11.083882,0 days 00:00:00.033083,0.0001,10000.0,geometric,1000.0,,0.0,COMPLETE,PA
1091,0.0,10.0,2026-07-23 15:50:11.086718,2026-07-23 15:50:18.862401,0 days 00:00:07.775683,10000.0,100.0,linear,0.1,,7.744,COMPLETE,PA
1092,0.0,10.0,2026-07-23 15:50:11.187898,2026-07-23 15:50:11.234465,0 days 00:00:00.046567,0.01,100.0,linear,10000.0,,0.0,COMPLETE,PA
1093,0.0,10.0,2026-07-23 15:50:11.234544,2026-07-23 15:50:18.783246,0 days 00:00:07.548702,0.1,0.0001,geometric,100.0,,7.498,COMPLETE,PA
1094,0.0,10.0,2026-07-23 15:50:11.238927,2026-07-23 15:50:19.009364,0 days 00:00:07.770437,10.0,0.1,geometric,10.0,,7.713,COMPLETE,PA
1095,0.0,10.0,2026-07-23 15:50:11.585601,2026-07-23 15:50:11.621320,0 days 00:00:00.035719,0.1,100.0,geometric,0.1,,0.0,COMPLETE,PA
1096,0.0,10.0,2026-07-23 15:50:11.621510,2026-07-23 15:50:11.657943,0 days 00:00:00.036433,0.01,1.0,linear,10.0,,0.0,COMPLETE,PA
1097,0.0,10.0,2026-07-23 15:50:11.659121,2026-07-23 15:50:19.354017,0 days 00:00:07.694896,100.0,10.0,geometric,100.0,,7.656,COMPLETE,PA
1098,0.0,10.0,2026-07-23 15:50:12.311967,2026-07-23 15:50:12.349949,0 days 00:00:00.037982,0.001,1000.0,linear,0.001,,0.0,COMPLETE,PA
1099,0.0,10.0,2026-07-23 15:50:12.358800,2026-07-23 15:50:19.997799,0 days 00:00:07.638999,1.0,0.001,geometric,10000.0,,7.602,COMPLETE,PA
1100,0.0,10.0,2026-07-23 15:50:12.424103,2026-07-23 15:50:20.134355,0 days 00:00:07.710252,10.0,0.01,geometric,0.1,,7.657,COMPLETE,PA
1101,0.0,10.0,2026-07-23 15:50:12.631632,2026-07-23 15:50:20.169472,0 days 00:00:07.537840,10000.0,100.0,linear,0.01,,7.486,COMPLETE,PA
1102,0.0,10.0,2026-07-23 15:50:12.869660,2026-07-23 15:50:20.456974,0 days 00:00:07.587314,0.01,0.01,geometric,0.0001,,7.497,COMPLETE,PA
1103,0.0,10.0,2026-07-23 15:50:17.498672,2026-07-23 15:50:17.534925,0 days 00:00:00.036253,0.001,10000.0,geometric,1000.0,,0.0,COMPLETE,PA
1104,0.0,10.0,2026-07-23 15:50:17.541795,2026-07-23 15:50:25.126798,0 days 00:00:07.585003,10.0,0.01,geometric,100.0,,7.553,COMPLETE,PA
1105,0.0,10.0,2026-07-23 15:50:18.366210,2026-07-23 15:50:18.394824,0 days 00:00:00.028614,0.0001,0.1,geometric,0.1,,0.0,COMPLETE,PA
1106,0.0,10.0,2026-07-23 15:50:18.402470,2026-07-23 15:50:26.087114,0 days 00:00:07.684644,100.0,0.0001,geometric,1.0,,7.651,COMPLETE,PA
1107,0.0,10.0,2026-07-23 15:50:18.786216,2026-07-23 15:50:18.817566,0 days 00:00:00.031350,1.0,10.0,geometric,0.001,,0.0,COMPLETE,PA
1108,0.0,10.0,2026-07-23 15:50:18.818519,2026-07-23 15:50:26.464939,0 days 00:00:07.646420,0.1,0.001,geometric,10.0,,7.606,COMPLETE,PA
1109,0.4,1.5846153846153845,2026-07-23 15:50:18.870169,2026-07-23 15:50:26.585792,0 days 00:00:07.715623,1000.0,10.0,linear,1.0,206.0,7.678,COMPLETE,PA
1110,0.0,10.0,2026-07-23 15:50:19.013730,2026-07-23 15:50:19.050596,0 days 00:00:00.036866,0.001,100.0,linear,0.0001,,0.0,COMPLETE,PA
1111,0.0,10.0,2026-07-23 15:50:19.050762,2026-07-23 15:50:19.085817,0 days 00:00:00.035055,0.1,100.0,geometric,100.0,,0.0,COMPLETE,PA
1112,0.0,10.0,2026-07-23 15:50:19.094959,2026-07-23 15:50:26.675977,0 days 00:00:07.581018,1.0,0.001,linear,0.0001,,7.522,COMPLETE,PA
1113,0.0,10.0,2026-07-23 15:50:19.356422,2026-07-23 15:50:26.984192,0 days 00:00:07.627770,100.0,10.0,geometric,0.1,,7.591,COMPLETE,PA
1114,0.0,10.0,2026-07-23 15:50:19.998856,2026-07-23 15:50:20.031488,0 days 00:00:00.032632,0.0001,0.001,geometric,0.001,,0.0,COMPLETE,PA
1115,0.0,10.0,2026-07-23 15:50:20.031635,2026-07-23 15:50:20.069907,0 days 00:00:00.038272,100.0,10000.0,linear,100.0,,0.0,COMPLETE,PA
1116,0.0,10.0,2026-07-23 15:50:20.071642,2026-07-23 15:50:20.103588,0 days 00:00:00.031946,0.001,100.0,linear,0.001,,0.0,COMPLETE,PA
1117,0.4,1.5846153846153845,2026-07-23 15:50:20.120000,2026-07-23 15:50:27.766612,0 days 00:00:07.646612,1000.0,10.0,linear,0.001,206.0,7.559,COMPLETE,PA
